,id,id_x,value,title,unit,id_y,Aggregationmethod,Developmentrelevance,IndicatorName,License_Type,License_URL,Limitationsandexceptions,Longdefinition,Periodicity,Source,Statisticalconceptandmethodology,Topic,Generalcomments,BasePeriod,Unitofmeasure,Othernotes
102,EN.ATM.HFCG.KT.CE,EN.ATM.HFCG.KT.CE,HFC gas emissions (thousand metric tons of CO2 equivalent),HFC gas emissions,thousand metric tons of CO2 equivalent,EN.ATM.HFCG.KT.CE,Gap-filled total,,HFC gas emissions (thousand metric tons of CO2 equivalent),CC BY-4.0,https://datacatalog.worldbank.org/public-licenses#cc-by,,"Hydrofluorocarbons, used as a replacement for chlorofluorocarbons, are used mainly in refrigeration and semiconductor manufacturing.",Annual,"European Commission, Joint Research Centre (JRC)/Netherlands Environmental Assessment Agency (PBL). Emission Database for Global Atmospheric Research (EDGAR): http://edgar.jrc.ec.europa.eu/",,Environment: Emissions,,,,
103,AG.LND.TOTL.K2,AG.LND.TOTL.K2,Land area (sq. km),Land area,sq. km,AG.LND.TOTL.K2,Sum,"Land area is particularly important for understanding an economy's agricultural capacity and the environmental effects of human activity. Innovations in satellite mapping and computer databases have resulted in more precise measurements of land and water areas.

Population, land area, income, and output are basic measures of the size of an economy. They also provide a broad indication of actual and potential resources. Land area is therefore used as one of the major indicator to normalize other indicators.",Land area (sq. km),CC BY-4.0,https://datacatalog.worldbank.org/public-licenses#cc-by,"The data are collected by the Food and Agriculture Organization (FAO) of the United Nations through annual questionnaires. The FAO tries to impose standard definitions and reporting methods, but complete consistency across countries and over time is not possible.

The data collected from official national sources through the questionnaire are supplemented with information from official secondary data sources. The secondary sources cover official country data from websites of national ministries, national publications and related country data reported by various international organizations.","Land area is a country's total area, excluding area under inland water bodies, national claims to continental shelf, and exclusive economic zones. In most cases the definition of inland water bodies includes major rivers and lakes.",Annual,"Food and Agriculture Organization, electronic files and web site.","Total land area does not include inland water bodies such as major rivers and lakes. Variations from year to year may be due to updated or revised data rather than to change in area. Including areas of former states; for example, the areas of the Union of Soviet Socialist Republics (USSR) are counted in Russian Federationand other successor states.",Environment: Land use,,,,Areas of former states are included in the successor states.
104,ER.H2O.FWST.ZS,ER.H2O.FWST.ZS,Level of water stress: freshwater withdrawal as a proportion of available freshwater resources,Level of water stress: freshwater withdrawal as a proportion of available freshwater resources,,ER.H2O.FWST.ZS,,"The level of water stress can show the degree to which water resources are being exploited to meet the country's water demand. It measures a country's pressure on its water resources and therefore the challenge on the sustainability of its water use. It tracks progress in regard to “withdrawals and supply of freshwater to address water scarcity”, i.e. the environmental component of target 6.4. It also shows to what extent water resources are already used, and signals the importance of effective supply and demand management policies. It indicates the likelihood of increasing competition and conflict between different water uses and users in a situation of increasing water scarcity. Increased water stress, shown by an increase in the value of the indicator, has potentially negative effects on the sustainability of the natural resources and on economic development. On the other hand, low values of water stress indicate that water does not represent a particular challenge for economic development and sustainability.",Level of water stress: freshwater withdrawal as a proportion of available freshwater resources,CC BY-4.0,https://datacatalog.worldbank.org/public-licenses#cc-by,"Water withdrawal as a percentage of water resources is a good indicator of pressure on limited water resources, one of the most important natural resources. However, it only partially addresses the issues related to sustainable water management. Supplementary indicators that capture the multiple dimensions of water management would combine data on water demand management, behavioural changes with regard to water use and the availability of appropriate infrastructure, and measure progress in increasing the efficiency and sustainability of water use, in particular in relation to population and economic growth. They would also recognize the different climatic environments that affect water use in countries, in particular in agriculture, which is the main user of water. Sustainability assessment is also linked to the critical thresholds fixed for this indicator and there is no universal consensus on such threshold.

Trends in water withdrawal show relatively slow patterns of change. Usually, three-five years are a minimum frequency to be able to detect significant changes, as it is unlikely that the indicator would show meaningful variations from one year to the other. Estimation of water withdrawal by sector is the main limitation to the computation of the indicator. Few countries actually publish water use data on a regular basis by sector. Renewable water resources include all surface water and groundwater resources that are available on a yearly basis without consideration of the capacity to harvest and use this resource. Exploitable water resources, which refer to the volume of surface water or groundwater that is available with an occurrence of 90% of the time, are considerably less than renewable water resources, but no universal method exists to assess such exploitable water resources. There is no universally agreed method for the computation of incoming freshwater flows originating outside of a country's borders. Nor is there any standard method to account for return flows, the part of the water withdrawn from its source and which flows back to the river system after use. In countries where return flow represents a substantial part of water withdrawal, the indicator tends to underestimate available water and therefore overestimate the level of water stress.

Other limitations that affect the interpretation of the water stress indicator include: difficulty to obtain accurate, complete and up-to-date data; potentially large variation of sub-national data; lack of account of seasonal variations in water resources; lack of consideration to the distribution among water uses; lack of consideration of water quality and its suitability for use; and the indicator can be higher than 100 per cent when water withdrawal includes secondary freshwater (water withdrawn previously and returned to the system), non-renewable water (fossil groundwater), when annual groundwater withdrawal is higher than annual replenishment (over-abstraction) or when water withdrawal includes part or all of the water set aside for environmental water requirements. Some of these issues can be solved through disaggregation of the index at the level of hydrological units and by distinguishing between different use sectors. However, due to the complexity of water flows, both within a country and between countries, care should be taken not to double-count.","The level of water stress: freshwater withdrawal as a proportion of available freshwater resources is the ratio between total freshwater withdrawn by all major sectors and total renewable freshwater resources, after taking into account environmental water requirements. Main sectors, as defined by ISIC standards, include agriculture; forestry and fishing; manufacturing; electricity industry; and services. This indicator is also known as water withdrawal intensity.",Annual,"Food and Agriculture Organization, AQUASTAT data.","Proportion of total renewable water resources withdrawn is the total volume of groundwater and surface water withdrawn from their sources for human use (in the agricultural, municipal and industrial sectors), expressed as a percentage of the total actual renewable water resources. The terms water resources and water withdrawal are understood as freshwater resources and freshwater withdrawal. Water withdrawal is estimated for the following three main sectors: agriculture, municipalities (including domestic water withdrawal) and industries, at country level and expressed in km3/year. The total actual renewable water resources for a country or region are defined as the sum of internal renewable water resources and the external renewable water resources, also expressed in km3/year. The indicator is computed by dividing total water withdrawal by total actual renewable water resources minus environmental requirements and expressed in percentage points.

Total freshwater withdrawal is the volume of freshwater extracted from its source (rivers, lakes, aquifers) for agriculture, industries and municipalities. It is estimated at the country level for the following three main sectors: agriculture, municipalities (including domestic water withdrawal) and industries. Freshwater withdrawal includes primary freshwater (not withdrawn before), secondary freshwater (previously withdrawn and returned to rivers and groundwater, such as discharged wastewater and agricultural drainage water) and fossil groundwater. It does not include non-conventional water, i.e. direct use of treated wastewater, direct use of agricultural drainage water and desalinated water. Total freshwater withdrawal is in general calculated as being the sum of total water withdrawal by sector minus direct use of wastewater, direct use of agricultural drainage water and use of desalinated water.

Total renewable freshwater resources are expressed as the sum of internal and external renewable water resources. The terms “water resources” and “water withdrawal” are understood here as freshwater resources and freshwater withdrawal. Internal renewable water resources are defined as the long-term average annual flow of rivers and recharge of groundwater for a given country generated from endogenous precipitation. External renewable water resources refer to the flows of water entering the country, taking into consideration the quantity of flows reserved to upstream and downstream countries through agreements or treaties.

Environmental water requirements (Env.) are the quantities of water required to sustain freshwater and estuarine ecosystems. Water quality and also the resulting ecosystem services are excluded from this formulation which is confined to water volumes. This does not imply that quality and the support to societies which are dependent on environmental flows are not important and should not be taken care of. Methods of computation of Env. are extremely variable and range from global estimates to comprehensive assessments for river reaches. Water volumes can be expressed in the same units as the total freshwater withdrawal, and then as percentages of the available water resources.",Environment: Freshwater,,,,
105,EN.MAM.THRD.NO,EN.MAM.THRD.NO,"Mammal species, threatened","Mammal species, threatened",,EN.MAM.THRD.NO,Sum,"As threats to biodiversity mount, the international community is increasingly focusing on conserving diversity. The number of threatened species is an important measure of the immediate need for conservation in an area. Global analyses of the status of threatened species have been carried out for few groups of organisms. Only for mammals, birds, and amphibians has the status of virtually all known species been assessed.

Threatened species are defined using the International Union for Conservation of Nature's (IUCN) classification: endangered (in danger of extinction and unlikely to survive if causal factors continue operating) and vulnerable (likely to move into the endangered category in the near future if causal factors continue operating).

The International Union for Conservation of Nature (IUCN) Red List of Threatened Species is widely recognized as the most comprehensive, objective global approach for evaluating the conservation status of plant and animal species. The IUCN draws on and mobilizes a network of scientists and partner organizations working in almost every country in the world, who collectively hold what is likely the most complete scientific knowledge base on the biology and conservation status of species.

the IUCN Red List covers a comprehensive assessment of the conservation status of the world's 5,488 mammal species, including global summary statistics, individual species accounts/threat category, range map, ecology information, and some other data. Mammal species are found spread across the globe, with the exception of the land mass of Antarctica. Nearly one-quarter of the world's mammal species are known to be globally threatened or extinct, 63 percent are known to not be threatened, and 15 percent have insufficient data to determine their threat status. Habitat loss, affecting over 2,000 mammal species, is the greatest threat globally. The second greatest threat is utilization which is affecting over 900 mammal species, mainly those in Asia.

Direct threats to species are the proximate human activities or processes that have impacted, are impacting, or may impact the status of the taxon being assessed (e.g., unsustainable fishing or logging). Direct threats are synonymous with sources of stress and proximate pressures. Threats can be past (historical, unlikely to return or historical, likely to return), ongoing, and/or likely to occur in the future.","Mammal species, threatened",CC BY-4.0,https://datacatalog.worldbank.org/public-licenses#cc-by,"Reporting the proportion of threatened species on the Red List is complicated by the fact that not all species groups have been fully evaluated, and also by the fact that some species have so little information available that they can only be assessed as Data Deficient (DD). For many of the incompletely evaluated groups, assessment efforts have focused on species that are likely to be threatened; therefore any percentage of threatened species reported for these groups would be heavily biased (i.e., the percentage of threatened species would likely be an overestimate).

Some parts of the world, such as the Andes, Central and West Africa, Angola, parts of South and Southeast Asia, and Melanesia, still have sparse information available of their mammal faunas. In addition, many species' names, especially in the tropics, actually represent complexes of several species that have not yet been resolved. The information on the relative importance of different threatening processes to mammal species is incomplete. IUCN codes all threats that appear to have an important impact, but not their relative importance for each species.

Since IUCN has evaluated extinction risk for less than 5 percent of the world's described species, IUCN cannot provide an overall estimate for how many of the planet's species are threatened. For those groups that have been comprehensively evaluated, the proportion of threatened species can be calculated, but the number of threatened species is often uncertain because it is not known whether Data Deficient species are actually threatened or not.

Due to variations in consistency and methods of collection, data quality is highly variable across countries. Some countries update their information more frequently than others, some have more accurate data on extent of coverage, and many underreport the number or extent of protected areas. Also, because of differences in definitions, reporting practices, and reporting periods, cross-country comparability of threatened species is limited.

In order to ensure global uniformity when describing the habitat in which a taxon (a taxonomic group of any rank) occurs, the threats to a taxon, what conservation actions are in place or are needed, and whether or not the taxon is utilized, a set of standard terms, called Classification Schemes, are being developed, for documenting taxonomy on the IUCN Red List.","Mammal species are mammals excluding whales and porpoises. Threatened species are the number of species classified by the IUCN as endangered, vulnerable, rare, indeterminate, out of danger, or insufficiently known.",Annual,"United Nations Environmental Program and the World Conservation Monitoring Centre, and International Union for Conservation of Nature, Red List of Threatened Species.","Species assessed as Critically Endangered (CR), Endangered (EN) or Vulnerable (VU) are referred to as ""threatened"" species. The International Union for Conservation of Nature (IUCN) Red List of Threatened Species collects and disseminates information on the global threated species.

Proportion of threatened species is only reported for the more completely evaluated groups (i.e., >90% of species evaluated). Also, the reported percentage of threatened species for each group is presented as a best estimate within a range of possible values bounded by lower and upper estimates:

Lower estimate = % threatened extant species if all Data Deficient species are not threatened, i.e., (CR + EN + VU) / (total assessed - EX)

Best estimate = % threatened extant species if Data Deficient species are equally threatened as data sufficient species, i.e., (CR + EN + VU) / (total assessed - EX - DD)

Upper estimate = % threatened extant species if all Data Deficient species are threatened, i.e., (CR + EN + VU + DD) / (total assessed - EX)

Additional information on ecology and habitat preferences, threats, and conservation action are also collated and assessed as part of Red List process.",Environment: Biodiversity & protected areas,,,,
106,EN.ATM.METH.ZG,EN.ATM.METH.ZG,Methane emissions (% change from 1990),Methane emissions,% change from 1990,EN.ATM.METH.ZG,Weighted average,"The addition of man-made greenhouse gases to the Atmosphere disturbs the earth's radiative balance. This is leading to an increase in the earth's surface temperature and to related effects on climate, sea level rise and world agriculture. Emissions of CO2 are from burning oil, coal and gas for energy use, burning wood and waste materials, and from industrial processes such as cement production. Emission intensity is the average emission rate of a given pollutant from a given source relative to the intensity of a specific activity. Emission intensities are also used to compare the environmental impact of different fuels or activities. The related terms - emission factor and carbon intensity - are often used interchangeably.

The carbon dioxide emissions of a country are only an indicator of one greenhouse gas. For a more complete idea of how a country influences climate change, gases such as methane and nitrous oxide should be taken into account. This is particularly important in agricultural economies.

The environmental effects of carbon dioxide are of significant interest. Carbon dioxide (CO2) makes up the largest share of the greenhouse gases contributing to global warming and climate change. Converting all other greenhouse gases (methane (CH4), nitrous oxide (N2O), hydrofluorocarbons (HFCs), perfluorocarbons (PFCs), Sulphur hexafluoride (SF6)) to carbon dioxide (or CO2) equivalents makes it possible to compare them and to determine their individual and total contributions to global warming. The Kyoto Protocol, an environmental agreement adopted in 1997 by many of the parties to the United Nations Framework Convention on Climate Change (UNFCCC), is working towards curbing CO2 emissions globally.",Methane emissions (% change from 1990),CC BY-4.0,https://datacatalog.worldbank.org/public-licenses#cc-by,"National reporting to the United Nations Framework Convention on Climate Change that follows the Intergovernmental Panel on Climate Change guidelines is based on national emission inventories and covers all sources of anthropogenic carbon dioxide emissions as well as carbon sinks (such as forests). To estimate emissions, the countries that are Parties to the Climate Change Convention (UNFCCC) use complex, state-of-the-art methodologies recommended by the Intergovernmental Panel on Climate Change (IPCC).",Methane emissions are those stemming from human activities such as agriculture and from industrial methane production. Each year of data shows the percentage change to that year from 1990.,Annual,"World Bank staff estimates from original source: European Commission, Joint Research Centre (JRC)/Netherlands Environmental Assessment Agency (PBL). Emission Database for Global Atmospheric Research (EDGAR): http://edgar.jrc.ec.europa.eu/.","Methane emissions are those stemming from human activities such as agriculture and from industrial methane production. Expressed in CO2 equivalent using the GWP100 metric of the Second Assessment Report of IPCC and include CH4 (GWP100=21). The emissions are usually expressed in carbon dioxide equivalents using the global warming potential, which allows the effective contributions of different gases to be compared. A kilogram of methane is 21 times as effective at trapping heat in the earth's atmosphere as a kilogram of carbon dioxide within 100 years.",Environment: Emissions,,,,
107,EN.ATM.METH.KT.CE,EN.ATM.METH.KT.CE,Methane emissions (kt of CO2 equivalent),Methane emissions,kt of CO2 equivalent,EN.ATM.METH.KT.CE,Sum,"The addition of man-made greenhouse gases to the Atmosphere disturbs the earth's radiative balance. This is leading to an increase in the earth's surface temperature and to related effects on climate, sea level rise and world agriculture. Emissions of CO2 are from burning oil, coal and gas for energy use, burning wood and waste materials, and from industrial processes such as cement production. Emission intensity is the average emission rate of a given pollutant from a given source relative to the intensity of a specific activity. Emission intensities are also used to compare the environmental impact of different fuels or activities. The related terms - emission factor and carbon intensity - are often used interchangeably.

The carbon dioxide emissions of a country are only an indicator of one greenhouse gas. For a more complete idea of how a country influences climate change, gases such as methane and nitrous oxide should be taken into account. This is particularly important in agricultural economies.

The environmental effects of carbon dioxide are of significant interest. Carbon dioxide (CO2) makes up the largest share of the greenhouse gases contributing to global warming and climate change. Converting all other greenhouse gases (methane (CH4), nitrous oxide (N2O), hydrofluorocarbons (HFCs), perfluorocarbons (PFCs), Sulphur hexafluoride (SF6)) to carbon dioxide (or CO2) equivalents makes it possible to compare them and to determine their individual and total contributions to global warming. The Kyoto Protocol, an environmental agreement adopted in 1997 by many of the parties to the United Nations Framework Convention on Climate Change (UNFCCC), is working towards curbing CO2 emissions globally.",Methane emissions (kt of CO2 equivalent),Attribution-NonCommercial 4.0 International (CC BY-NC 4.0),https://creativecommons.org/licenses/by-nc/4.0/,"This series excludes Land-use Change & Forestry (LUCF). 

The world data includes international bunker fuel-related emissions and emissions from territories not part of the United Nations Framework Convention on Climate Change (UNFCCC).",Methane emissions are those stemming from human activities such as agriculture and from industrial methane production.,Annual,"Climate Watch Historical GHG Emissions (1990-2020). 2023. Washington, DC: World Resources Institute. Available online at: https://www.climatewatchdata.org/ghg-emissions","Methane emissions are those stemming from human activities such as agriculture and from industrial methane production. Expressed in CO2 equivalent using the GWP100 metric of the Second Assessment Report of IPCC and include CH4 (GWP100=21). The emissions are usually expressed in carbon dioxide equivalents using the global warming potential, which allows the effective contributions of different gases to be compared. A kilogram of methane is 21 times as effective at trapping heat in the earth's atmosphere as a kilogram of carbon dioxide within 100 years.",Environment: Emissions,,,,
