,id,id_x,value,title,unit,id_y,Aggregationmethod,Developmentrelevance,IndicatorName,License_Type,License_URL,Limitationsandexceptions,Longdefinition,Periodicity,Source,Statisticalconceptandmethodology,Topic,Generalcomments,BasePeriod,Unitofmeasure,Othernotes
71,EG.CFT.ACCS.UR.ZS,EG.CFT.ACCS.UR.ZS,"Access to clean fuels and technologies for cooking, urban (% of urban population)","Access to clean fuels and technologies for cooking, urban",% of urban population,EG.CFT.ACCS.UR.ZS,Weighted average,,"Access to clean fuels and technologies for cooking, urban (% of urban population)",CC BY-4.0,https://datacatalog.worldbank.org/public-licenses#cc-by,,"Access to clean fuels and technologies for cooking, urban is the proportion of urban population primarily using clean cooking fuels and technologies for cooking. Under WHO guidelines, kerosene is excluded from clean cooking fuels.",Annual,"IEA, IRENA, UNSD, World Bank, WHO. 2023. Tracking SDG 7: The Energy Progress Report. World Bank, Washington DC. © World Bank. License: Creative Commons Attribution—NonCommercial 3.0 IGO (CC BY-NC 3.0 IGO).","Data for access to clean fuels and technologies for cooking are based on the World Health Organization’s (WHO) Global Household Energy Database. They are collected among different sources: only data from nationally representative household surveys (including national censuses) were used. Survey sources include Demographic and Health Surveys (DHS) and Living Standards Measurement Surveys (LSMS), Multi-Indicator Cluster Surveys (MICS), the World Health Survey (WHS), other nationally developed and implemented surveys, and various government agencies (for example, ministries of energy and utilities). Trends in the proportion of the population using each fuel type are estimated using a single multivariate hierarchical model, with urban and rural disaggregation. Estimates for overall ‘polluting’ fuels (unprocessed biomass, charcoal, coal, and kerosene) and ‘clean’ fuels (gaseous fuels, electricity, as well as an aggregation of any other clean fuels like alcohol) are produced by aggregating estimates of relevant fuel types. The model was used to derive clean fuel use estimates for 191 countries (ref. Stoner, O., Shaddick, G., Economou, T., Gumy, S., Lewis, J., Lucio, I., Ruggeri, G. and Adair-Rohani, H. (2020), Global household energy model: a multivariate hierarchical approach to estimating trends in the use of polluting and clean fuels for cooking. J. R. Stat. Soc. C, 69: 815-839). Countries classified by the World Bank as high income (57 countries) in the 2022 fiscal year are assumed to have universal access to clean fuels and technologies for cooking.",Environment: Energy production & use,,,,
72,EG.ELC.ACCS.ZS,EG.ELC.ACCS.ZS,Access to electricity (% of population),Access to electricity,% of population,EG.ELC.ACCS.ZS,Weighted average,"Maintaining reliable and secure electricity services while seeking to rapidly decarbonize power systems is a key challenge for countries throughout the world. More and more countries are becoming increasing dependent on reliable and secure electricity supplies to underpin economic growth and community prosperity. This reliance is set to grow as more efficient and less carbon intensive forms of power are developed and deployed to help decarbonize economies.

Energy is necessary for creating the conditions for economic growth. It is impossible to operate a factory, run a shop, grow crops or deliver goods to consumers without using some form of energy. Access to electricity is particularly crucial to human development as electricity is, in practice, indispensable for certain basic activities, such as lighting, refrigeration and the running of household appliances, and cannot easily be replaced by other forms of energy. Individuals' access to electricity is one of the most clear and un-distorted indication of a country's energy poverty status.

Electricity access is increasingly at the forefront of governments' preoccupations, especially in the developing countries. As a consequence, a lot of rural electrification programs and national electrification agencies have been created in these countries to monitor more accurately the needs and the status of rural development and electrification.

Use of energy is important in improving people's standard of living. But electricity generation also can damage the environment. Whether such damage occurs depends largely on how electricity is generated. For example, burning coal releases twice as much carbon dioxide - a major contributor to global warming - as does burning an equivalent amount of natural gas.",Access to electricity (% of population),CC BY-4.0,https://datacatalog.worldbank.org/public-licenses#cc-by,,"Access to electricity is the percentage of population with access to electricity. Electrification data are collected from industry, national surveys and international sources.",Annual,"IEA, IRENA, UNSD, World Bank, WHO. 2023. Tracking SDG 7: The Energy Progress Report. World Bank, Washington DC. © World Bank. License: Creative Commons Attribution—NonCommercial 3.0 IGO (CC BY-NC 3.0 IGO).","The World Bank’s Global Electrification Database (GED) compiles nationally representative household survey data, and occasionally census data, from sources going back as far as 1990. The database also incorporates data from the Socio-Economic Database for Latin America and the Caribbean (SEDLAC), Middle East and North Africa Poverty Database (MNAPOV) and the Europe and Central Asia Poverty Database (ECAPOV), which are based on similar surveys. At the time of this analysis, the GED contained 1,375 surveys for 149 countries in 1990-2021.",Environment: Energy production & use,,,,
73,NY.ADJ.SVNX.GN.ZS,NY.ADJ.SVNX.GN.ZS,"Adjusted net savings, excluding particulate emission damage (% of GNI)","Adjusted net savings, excluding particulate emission damage",% of GNI,NY.ADJ.SVNX.GN.ZS,Weighted average,,"Adjusted net savings, excluding particulate emission damage (% of GNI)",CC BY-4.0,https://datacatalog.worldbank.org/public-licenses#cc-by,,"Adjusted net savings are equal to net national savings plus education expenditure and minus energy depletion, mineral depletion, net forest depletion, and carbon dioxide. This series excludes particulate emissions damage.",Annual,"World Bank staff estimates based on sources and methods in World Bank's ""The Changing Wealth of Nations: Measuring Sustainable Development in the New Millennium"" (2011).",,Economic Policy & Debt: National accounts: Adjusted savings & income,,,,
74,NY.ADJ.SVNX.CD,NY.ADJ.SVNX.CD,"Adjusted net savings, excluding particulate emission damage (current US$)","Adjusted net savings, excluding particulate emission damage",current US$,NY.ADJ.SVNX.CD,,,"Adjusted net savings, excluding particulate emission damage (current US$)",CC BY-4.0,https://datacatalog.worldbank.org/public-licenses#cc-by,,"Adjusted net savings are equal to net national savings plus education expenditure and minus energy depletion, mineral depletion, net forest depletion, and carbon dioxide. This series excludes particulate emissions damage.",Annual,"World Bank staff estimates based on sources and methods in World Bank's ""The Changing Wealth of Nations: Measuring Sustainable Development in the New Millennium"" (2011).",,Economic Policy & Debt: National accounts: Adjusted savings & income,,,,
75,NY.ADJ.SVNG.CD,NY.ADJ.SVNG.CD,"Adjusted net savings, including particulate emission damage (current US$)","Adjusted net savings, including particulate emission damage",current US$,NY.ADJ.SVNG.CD,,,"Adjusted net savings, including particulate emission damage (current US$)",CC BY-4.0,https://datacatalog.worldbank.org/public-licenses#cc-by,,"Adjusted net savings are equal to net national savings plus education expenditure and minus energy depletion, mineral depletion, net forest depletion, and carbon dioxide and particulate emissions damage.",Annual,"World Bank staff estimates based on sources and methods in World Bank's ""The Changing Wealth of Nations: Measuring Sustainable Development in the New Millennium"" (2011).",,Economic Policy & Debt: National accounts: Adjusted savings & income,,,,
76,NY.ADJ.DCO2.GN.ZS,NY.ADJ.DCO2.GN.ZS,Adjusted savings: carbon dioxide damage (% of GNI),Adjusted savings: carbon dioxide damage,% of GNI,NY.ADJ.DCO2.GN.ZS,Weighted average,,Adjusted savings: carbon dioxide damage (% of GNI),CC BY-4.0,https://datacatalog.worldbank.org/public-licenses#cc-by,,"Cost of damage due to carbon dioxide emissions from fossil fuel use and the manufacture of cement, estimated to be US$40 per ton of CO2 (the unit damage in 2017 US dollars for CO2 emitted in 2020) times the number of tons of CO2 emitted.",Annual,World Bank staff estimates based on sources and methods described in the World Bank's The Changing Wealth of Nations.,Pollution damage from emissions of carbon dioxide is calculated as the marginal social cost per unit multiplied by the increase in the stock of carbon dioxide. The unit damage figure represents the present value of global damage to economic assets and to human welfare over the time the unit of pollution remains in the atmosphere.,Economic Policy & Debt: National accounts: Adjusted savings & income,,,,
77,NY.ADJ.DCO2.CD,NY.ADJ.DCO2.CD,Adjusted savings: carbon dioxide damage (current US$),Adjusted savings: carbon dioxide damage,current US$,NY.ADJ.DCO2.CD,,,Adjusted savings: carbon dioxide damage (current US$),CC BY-4.0,https://datacatalog.worldbank.org/public-licenses#cc-by,,"Cost of damage due to carbon dioxide emissions from fossil fuel use and the manufacture of cement, estimated to be US$40 per ton of CO2 (the unit damage in 2017 US dollars for CO2 emitted in 2020) times the number of tons of CO2 emitted.",Annual,World Bank staff estimates based on sources and methods described in the World Bank's The Changing Wealth of Nations.,Pollution damage from emissions of carbon dioxide is calculated as the marginal social cost per unit multiplied by the increase in the stock of carbon dioxide. The unit damage figure represents the present value of global damage to economic assets and to human welfare over the time the unit of pollution remains in the atmosphere.,Economic Policy & Debt: National accounts: Adjusted savings & income,,,,
78,NY.ADJ.DKAP.CD,NY.ADJ.DKAP.CD,Adjusted savings: consumption of fixed capital (current US$),Adjusted savings: consumption of fixed capital,current US$,NY.ADJ.DKAP.CD,,,Adjusted savings: consumption of fixed capital (current US$),CC BY-4.0,https://datacatalog.worldbank.org/public-licenses#cc-by,,Consumption of fixed capital represents the replacement value of capital used up in the process of production.,Annual,World Bank staff estimates using data from the United Nations Statistics Division's National Accounts Statistics.,,Economic Policy & Debt: National accounts: Adjusted savings & income,,,,
79,NY.ADJ.AEDU.GN.ZS,NY.ADJ.AEDU.GN.ZS,Adjusted savings: education expenditure (% of GNI),Adjusted savings: education expenditure,% of GNI,NY.ADJ.AEDU.GN.ZS,Weighted average,,Adjusted savings: education expenditure (% of GNI),CC BY-4.0,https://datacatalog.worldbank.org/public-licenses#cc-by,"Public education expenditures are considered an addition to savings. However, because of the wide variability in the effectiveness of public education expenditures, these figures cannot be construed as the value of investments in human capital. A current expenditure of $1 on education does not necessarily yield $1 of human capital. The calculation should also consider private education expenditure, but data are not available for a large number of countries.","Education expenditure refers to the current operating expenditures in education, including wages and salaries and excluding capital investments in buildings and equipment.",Annual,"World Bank staff estimates using data from the United Nations Statistics Division's Statistical Yearbook, and the UNESCO Institute for Statistics online database.",,Economic Policy & Debt: National accounts: Adjusted savings & income,,,,
80,NY.ADJ.ICTR.GN.ZS,NY.ADJ.ICTR.GN.ZS,Adjusted savings: gross savings (% of GNI),Adjusted savings: gross savings,% of GNI,NY.ADJ.ICTR.GN.ZS,Weighted average,Gross savings is used as a starting point for calculating adjusted net savings. Adjusted net saving is an indicator of the sustainability of an economy.,Adjusted savings: gross savings (% of GNI),CC BY-4.0,https://datacatalog.worldbank.org/public-licenses#cc-by,"Because gross savings is calculated as a residual it includes errors, which may not be offsetting, in its components.","Gross savings are the difference between gross national income and public and private consumption, plus net current transfers.",Annual,World Bank national accounts data files.,Gross savings are calculated as a residual from the national accounts by taking the difference between income earned by residents (including income received from abroad and workers' remittances) and their consumption expenditures.,Economic Policy & Debt: National accounts: Adjusted savings & income,,,,
81,NY.ADJ.NNAT.GN.ZS,NY.ADJ.NNAT.GN.ZS,Adjusted savings: net national savings (% of GNI),Adjusted savings: net national savings,% of GNI,NY.ADJ.NNAT.GN.ZS,Weighted average,,Adjusted savings: net national savings (% of GNI),CC BY-4.0,https://datacatalog.worldbank.org/public-licenses#cc-by,,Net national savings are equal to gross national savings less the value of consumption of fixed capital.,Annual,"World Bank staff estimates based on sources and methods in World Bank's ""The Changing Wealth of Nations: Measuring Sustainable Development in the New Millennium"" (2011).",,Economic Policy & Debt: National accounts: Adjusted savings & income,,,,
82,NY.ADJ.DPEM.GN.ZS,NY.ADJ.DPEM.GN.ZS,Adjusted savings: particulate emission damage (% of GNI),Adjusted savings: particulate emission damage,% of GNI,NY.ADJ.DPEM.GN.ZS,Weighted average,"Air pollution places a major burden on world health. In many places, including cities but also nearby rural areas, exposure to air pollution exposure is the main environmental threat to health. Long-term exposure to high levels of fine particulates in the air contributes to a range of health effects, including respiratory diseases, lung cancer, and heart disease, resulting in 3.2 million deaths annually according to the Global Burden of Disease 2010 study. Not only does exposure to air pollution affect the health of the world’s people, it also carries huge economic costs and represents a drag on development, particularly for low and middle income countries and vulnerable segments of the population such as children and the elderly.",Adjusted savings: particulate emission damage (% of GNI),CC BY-4.0,https://datacatalog.worldbank.org/public-licenses#cc-by,"Labor productivity losses, as calculated within the framework of adjusted net savings, represent only part of the economic costs of air pollution and should be interpreted as a lower-end estimate.","Particulate emissions damage is the damage due to exposure of a country's population to ambient concentrations of particulates measuring less than 2.5 microns in diameter (PM2.5), ambient ozone pollution, and indoor concentrations of PM2.5 in households cooking with solid fuels. Damages are calculated as foregone labor income due to premature death. Estimates of health impacts from the Global Burden of Disease Study 2013 are for 1990, 1995, 2000, 2005, 2010, and 2013. Data for other years have been extrapolated from trends in mortality rates.",Annual,Data on health impacts from exposure to ambient PM2.5 pollution and household air pollution are from the Global Burden of Disease 2013 study. Data are provided by the Institute for Health Metrics and Evaluation at the University of Washington.,"Within the national accounting framework, air pollution damages are estimated following a human capital approach. Damages from premature mortality are calculated as the present value of lost income during working age, 15-64. Premature mortality among children is valued by adjusting for years until working age and discounting more heavily into the future. Damages from morbidity (years lived with disability) are estimated for adults in working age only without discounting into the future. Estimates are for both urban and rural areas. Exposure to household air pollution is proxied by the number of households in each country cooking with solid fuels.",Economic Policy & Debt: National accounts: Adjusted savings & income,,,,
83,NY.ADJ.DPEM.CD,NY.ADJ.DPEM.CD,Adjusted savings: particulate emission damage (current US$),Adjusted savings: particulate emission damage,current US$,NY.ADJ.DPEM.CD,,,Adjusted savings: particulate emission damage (current US$),CC BY-4.0,https://datacatalog.worldbank.org/public-licenses#cc-by,,"Particulate emissions damage is the damage due to exposure of a country's population to ambient concentrations of particulates measuring less than 2.5 microns in diameter (PM2.5), ambient ozone pollution, and indoor concentrations of PM2.5 in households cooking with solid fuels. Damages are calculated as foregone labor income due to premature death. Estimates of health impacts from the Global Burden of Disease Study 2013 are for 1990, 1995, 2000, 2005, 2010, and 2013. Data for other years have been extrapolated from trends in mortality rates.",Annual,Data on health impacts from exposure to ambient PM2.5 pollution and household air pollution are from the Global Burden of Disease 2013 study. Data are provided by the Institute for Health Metrics and Evaluation at the University of Washington.,,Economic Policy & Debt: National accounts: Adjusted savings & income,,,,
84,AG.LND.AGRI.ZS,AG.LND.AGRI.ZS,Agricultural land (% of land area),Agricultural land,% of land area,AG.LND.AGRI.ZS,Weighted average,"Agricultural land covers more than one-third of the world's land area, with arable land representing less than one-third of agricultural land (about 10 percent of the world's land area). Agricultural land constitutes only a part of any country's total area, which can include areas not suitable for agriculture, such as forests, mountains, and inland water bodies.

In many industrialized countries, agricultural land is subject to zoning regulations. In the context of zoning, agricultural land (or more properly agriculturally zoned land) refers to plots that may be used for agricultural activities, regardless of the physical type or quality of land.

FAO's agricultural land data contains a wide range of information on variables that are significant for: understanding the structure of a country's agricultural sector; making economic plans and policies for food security; deriving environmental indicators, including those related to investment in agriculture and data on gross crop area and net crop area which are useful for policy formulation and monitoring.

There is no single correct mix of inputs to the agricultural land, as it is dependent on local climate, land quality, and economic development; appropriate levels and application rates vary by country and over time and depend on the type of crops, the climate and soils, and the production process used.",Agricultural land (% of land area),CC BY-4.0,https://datacatalog.worldbank.org/public-licenses#cc-by,"The data are collected by the Food and Agriculture Organization of the United Nations (FAO) from official national sources through annual questionnaires and are supplemented with information from official secondary data sources. The secondary sources cover official country data from websites of national ministries, national publications and related country data reported by various international organizations.. The FAO tries to impose standard definitions and reporting methods, but complete consistency across countries and over time is not possible. Thus, data on agricultural land in different climates may not be comparable. For example, permanent pastures are quite different in nature and intensity in African countries and dry Middle Eastern countries. Data on agricultural employment, in particular, should be used with caution. In many countries much agricultural employment is informal and unrecorded, including substantial work performed by women and children. To address some of these concerns, this indicator is heavily footnoted in the database in sources, definition, and coverage.","Agricultural land refers to the share of land area that is arable, under permanent crops, and under permanent pastures. Arable land includes land defined by the FAO as land under temporary crops (double-cropped areas are counted once), temporary meadows for mowing or for pasture, land under market or kitchen gardens, and land temporarily fallow. Land abandoned as a result of shifting cultivation is excluded. Land under permanent crops is land cultivated with crops that occupy the land for long periods and need not be replanted after each harvest, such as cocoa, coffee, and rubber. This category includes land under flowering shrubs, fruit trees, nut trees, and vines, but excludes land under trees grown for wood or timber. Permanent pasture is land used for five or more years for forage, including natural and cultivated crops.",Annual,"Food and Agriculture Organization, electronic files and web site.","Agriculture is still a major sector in many economies, and agricultural activities provide developing countries with food and revenue. But agricultural activities also can degrade natural resources. Poor farming practices can cause soil erosion and loss of soil fertility. Efforts to increase productivity by using chemical fertilizers, pesticides, and intensive irrigation have environmental costs and health impacts. Excessive use of chemical fertilizers can alter the chemistry of soil. Pesticide poisoning is common in developing countries. And salinization of irrigated land diminishes soil fertility. Thus, inappropriate use of inputs for agricultural production has far-reaching effects.

Agricultural land is also sometimes classified as irrigated and non-irrigated land. In arid and semi-arid countries agriculture is often confined to irrigated land, with very little farming possible in non-irrigated areas. Land abandoned as a result of shifting cultivation is excluded from Arable land.

Data on agricultural land are valuable for conducting studies on a various perspectives concerning agricultural production, food security and for deriving cropping intensity among others uses. Agricultural land indicator, along with land-use indicators, can also elucidate the environmental sustainability of countries' agricultural practices.

Total land area does not include inland water bodies such as major rivers and lakes. Variations from year to year may be due to updated or revised data rather than to change in area.",Environment: Land use,,,,Areas of former states are included in the successor states.
