,id,id_x,value,title,unit,id_y,Aggregationmethod,Developmentrelevance,IndicatorName,License_Type,License_URL,Limitationsandexceptions,Longdefinition,Periodicity,Source,Statisticalconceptandmethodology,Topic,Generalcomments,BasePeriod,Unitofmeasure,Othernotes
36,EN.FSH.THRD.NO,EN.FSH.THRD.NO,"Fish species, threatened","Fish species, threatened",,EN.FSH.THRD.NO,Sum,"As threats to biodiversity mount, the international community is increasingly focusing on conserving diversity. The Red List Index for the world's birds shows that there has been a steady and continuing deterioration in the threat status of the world's birds since 1988, when the first complete global assessment was carried out.

The number of threatened species is an important measure of the immediate need for conservation in an area. Global analyses of the status of threatened species have been carried out for few groups of organisms. Only for mammals, birds, and amphibians has the status of virtually all known species been assessed.

Threatened species are defined using the International Union for Conservation of Nature's (IUCN) classification: endangered (in danger of extinction and unlikely to survive if causal factors continue operating) and vulnerable (likely to move into the endangered category in the near future if causal factors continue operating).

The International Union for Conservation of Nature (IUCN) Red List of Threatened Species is widely recognized as the most comprehensive, objective global approach for evaluating the conservation status of plant and animal species. The IUCN guides conservation activities of governments, NGOs and scientific institutions. The introduction in 1994 of a scientifically rigorous approach to determine risks of extinction that is applicable to all species, has become a world standard. The IUCN draws on and mobilizes a network of scientists and partner organizations working in almost every country in the world, who collectively hold what is likely the most complete scientific knowledge base on the biology and conservation status of species.

The freshwater system represents the most threatened of all ecosystems, and many freshwater species have a very high livelihood value for local human communities. IUCN's freshwater focus is on the following taxonomic groups: fish; molluscs; crabs and crayfish; and dragonflies. Global assessment of these groups is being pursued through a series of regional projects, such as one for Africa that is currently being implemented.

The marine realm is poorly covered in the IUCN Red List, comprising less than 5 percent of the species included. IUCN has identified priority taxonomic groups of marine fish, invertebrates, plants (mangroves and seagrasses) and macro-algae (seaweeds). If these priority groups can be assessed, the number of marine species on the IUCN Red List will be increased more than six-fold.

Direct threats to species are the proximate human activities or processes that have impacted, are impacting, or may impact the status of the taxon being assessed (e.g., unsustainable fishing or logging). Direct threats are synonymous with sources of stress and proximate pressures. Threats can be past (historical, unlikely to return or historical, likely to return), ongoing, and/or likely to occur in the future.","Fish species, threatened",CC BY-4.0,https://datacatalog.worldbank.org/public-licenses#cc-by,"Reporting the proportion of threatened species on the Red List is complicated by the fact that not all species groups have been fully evaluated, and also by the fact that some species have so little information available that they can only be assessed as Data Deficient (DD). For many of the incompletely evaluated groups, assessment efforts have focused on species that are likely to be threatened; therefore any percentage of threatened species reported for these groups would be heavily biased (i.e., the percentage of threatened species would likely be an overestimate).

Since IUCN has evaluated extinction risk for less than 5 percent of the world's described species, IUCN cannot provide an overall estimate for how many of the planet's species are threatened. For those groups that have been comprehensively evaluated, the proportion of threatened species can be calculated, but the number of threatened species is often uncertain because it is not known whether Data Deficient species are actually threatened or not.

Due to variations in consistency and methods of collection, data quality is highly variable across countries. Some countries update their information more frequently than others, some have more accurate data on extent of coverage, and many underreport the number or extent of protected areas. Also, because of differences in definitions, reporting practices, and reporting periods, cross-country comparability of threatened species is limited.

In order to ensure global uniformity when describing the habitat in which a taxon (a taxonomic group of any rank) occurs, the threats to a taxon, what conservation actions are in place or are needed, and whether or not the taxon is utilized, a set of standard terms, called Classification Schemes, are being developed, for documenting taxonomy on the IUCN Red List.","Fish species are based on Froese, R. and Pauly, D. (eds). 2008. Threatened species are the number of species classified by the IUCN as endangered, vulnerable, rare, indeterminate, out of danger, or insufficiently known.",Annual,"Froese, R. and Pauly, D. (eds). 2008. FishBase database, www.fishbase.org.","Species assessed as Critically Endangered (CR), Endangered (EN) or Vulnerable (VU) are referred to as ""threatened"" species. The International Union for Conservation of Nature (IUCN) Red List of Threatened Species collects and disseminates information on the global threated species.

Proportion of threatened species is only reported for the more completely evaluated groups (i.e., >90% of species evaluated). Also, the reported percentage of threatened species for each group is presented as a best estimate within a range of possible values bounded by lower and upper estimates:

Lower estimate = % threatened extant species if all Data Deficient species are not threatened, i.e., (CR + EN + VU) / (total assessed - EX)

Best estimate = % threatened extant species if Data Deficient species are equally threatened as data sufficient species, i.e., (CR + EN + VU) / (total assessed - EX - DD)

Upper estimate = % threatened extant species if all Data Deficient species are threatened, i.e., (CR + EN + VU + DD) / (total assessed - EX)

Additional information on ecology and habitat preferences, threats, and conservation action are also collated and assessed as part of Red List process.",Environment: Biodiversity & protected areas,,,,
37,EN.CLC.GHGR.MT.CE,EN.CLC.GHGR.MT.CE,GHG net emissions/removals by LUCF (Mt of CO2 equivalent),GHG net emissions/removals by LUCF,Mt of CO2 equivalent,EN.CLC.GHGR.MT.CE,,,GHG net emissions/removals by LUCF (Mt of CO2 equivalent),CC BY-4.0,https://datacatalog.worldbank.org/public-licenses#cc-by,,"GHG net emissions/removals by LUCF refers to changes in atmospheric levels of all greenhouse gases attributable to forest and land-use change activities, including but not limited to (1) emissions and removals of CO2 from decreases or increases in biomass stocks due to forest management, logging, fuelwood collection, etc.; (2) conversion of existing forests and natural grasslands to other land uses; (3) removal of CO2 from the abandonment of formerly managed lands (e.g. croplands and pastures); and (4) emissions and removals of CO2 in soil associated with land-use change and management. For Annex-I countries under the UNFCCC, these data are drawn from the annual GHG inventories submitted to the UNFCCC by each country; for non-Annex-I countries, data are drawn from the most recently submitted National Communication where available. Because of differences in reporting years and methodologies, these data are not generally considered comparable across countries. Data are in million metric tons.",Annual,United Nations Framework Convention on Climate Change.,,Environment: Emissions,,,,
38,AG.LND.EL5M.ZS,AG.LND.EL5M.ZS,Land area where elevation is below 5 meters (% of total land area),Land area where elevation is below 5 meters,% of total land area,AG.LND.EL5M.ZS,Weighted average,"Scientists use the terms climate change and global warming to refer to the gradual increase in the Earth's surface temperature that has accelerated since the industrial revolution and especially over the past two decades. Most global warming has been caused by human activities that have changed the chemical composition of the atmosphere through a buildup of greenhouse gases - primarily carbon dioxide, methane, and nitrous oxide. Rising global temperatures will cause sea level rise and alter local climate conditions, affecting forests, crop yields, and water supplies, and may affect human health, animals, and many types of ecosystems.",Land area where elevation is below 5 meters (% of total land area),CC BY-4.0,https://datacatalog.worldbank.org/public-licenses#cc-by,"The 2007 Intergovernmental Panel on Climate Change's (IPCC) assessment report concluded that global warming is “unequivocal” and gave the strongest warning yet about the role of human activities. The report estimated that sea levels would rise approximately 49 centimeters over the next 100 years, with a range of uncertainty of 20–86 centimeters. That will lead to increased coastal flooding through direct inundation and a higher base for storm surges, allowing flooding of larger areas and higher elevations. Climate model simulations predict an increase in average surface air temperature of about 2.5°C by 2100 (Kattenberg and others 1996) and increase of “killer” heat waves during the warm season (Karl and others 1997).",Land area below 5m is the percentage of total land where the elevation is 5 meters or less.,Annual,"Center for International Earth Science Information Network - CIESIN - Columbia University, and CUNY Institute for Demographic Research - CIDR - City University of New York. 2021. Low Elevation Coastal Zone (LECZ) Urban-Rural Population and Land Area Estimates, Version 3. Palisades, NY: NASA Socioeconomic Data and Applications Center (SEDAC). https://doi.org/10.7927/d1x1-d702.",Elevation data used to generate the low elevation coastal zones come from the SRTM3 Enhanced Global Map developed by ISCIENCES. The ISCIENCES digital elevation model was created using NASA’s Jet Propulsion Laboratory Shuttle Radar Topography Mission data processed to 3 arc-seconds (SRTM3).,Environment: Land use,,,,
39,ER.MRN.PTMR.ZS,ER.MRN.PTMR.ZS,Marine protected areas (% of territorial waters),Marine protected areas,% of territorial waters,ER.MRN.PTMR.ZS,Weighted average,"The International Union for Conservation of Nature (IUCN) defines a protected area as ""a clearly defined geographical space, recognized, dedicated and managed, through legal or other effective means, to achieve the long-term conservation of nature with associated ecosystem services and cultural values.""

Marine protected areas are areas of intertidal or subtidal terrain - and overlying water and associated flora and fauna and historical and cultural features - that have been reserved by law or other effective means to protect part or the entire enclosed environment. Sites protected under local or provincial law are excluded.

As threats to biodiversity mount, the international community is increasingly focusing on conserving diversity. Deforestation is a major cause of loss of biodiversity, and habitat conservation is vital for stemming this loss. Conservation efforts have focused on protecting areas of high biodiversity. Increasing the proportion of terrestrial and marine areas protected helps defend vulnerable plant and animal species and safeguard biodiversity.
 
Protected areas remain the fundamental building blocks of virtually all national and international conservation strategies, supported by governments and international institutions. They provide the core of efforts to protect the world's threatened species and are increasingly recognized as essential providers of ecosystem services and biological resources. Some sites are owned and managed by governments, others by private individuals, companies, communities and faith groups.

The Sustainable Development Goals (SDGs) address concerns common to all economies. In recognition of the vulnerability of animal and plant species, SDGs include targets 14 and 15 to highlight the importance of marine and terrestorial protected areas. Increasing the proportion of terrestrial and marine areas protected helps defend vulnerable plant and animal species and safeguard biodiversity.",Marine protected areas (% of territorial waters),Use and distribution of these data are subject to Protected Planet terms and conditions.,https://www.protectedplanet.net/c/terms-and-conditions,"The data source for this indicator is the World Database on Protected Areas (WDPA), the most comprehensive global dataset on marine and terrestrial protected areas available. 

The extent to which the land areas, including inland waters, and territorial waters of a country/territory are protected is useful for planning purpose to protect biodiversity. However, it is neither an indication of how well managed the terrestrial and marine protected areas are, nor confirmation that protection measures are effectively enforced. Further, the indicator does not provide information on non-designated or internationally designated protected areas that may also be important for conserving biodiversity. There are known data and knowledge gaps for some countries/regions due to difficulties in reporting national protected area data to the WDPA and/or determining whether a site conforms to the IUCN definition of a protected area.

Gaps and/or time lags in reporting national protected area data to the WDPA can however result in discrepancies, which are resolved in communication with data providers. The World Conservation Monitoring Centre (WCMC) compiles data on protected areas, numbers of certain species, and numbers of those species under threat from various sources. Because of differences in definitions, reporting practices, and reporting periods, cross-country comparability is limited.

Due to variations in consistency and methods of collection, data quality is highly variable across countries. Some countries update their information more frequently than others, some have more accurate data on extent of coverage, and many underreport the number or extent of protected areas.",Marine protected areas are areas of intertidal or subtidal terrain--and overlying water and associated flora and fauna and historical and cultural features--that have been reserved by law or other effective means to protect part or all of the enclosed environment.,Annual,"World Database on Protected Areas (WDPA) where the compilation and management is carried out by United Nations Environment World Conservation Monitoring Centre (UNEP-WCMC) in collaboration with governments, non-governmental organizations, academia and industry. The data is available online through the Protected Planet website (https://www.protectedplanet.net/).","This indicator is calculated using all the nationally designated protected areas recorded in the World Database on Protected Areas (WDPA) whose location and extent is known. The WDPA database is stored within a Geographic Information System (GIS) that stores information about protected areas such as their name, type and date of designation, documented area, geographic location (point) and/or boundary (polygon). 

Designating an area as protected does not mean that protection is in force. And for small countries that have only protected areas smaller than 1,000 hectares, the size limit in the definition leads to an underestimate of protected areas. Nationally protected areas are defined using the six IUCN management categories for areas of at least 1,000 hectares: scientific reserves and strict nature reserves with limited public access; national parks of national or international significance and not materially affected by human activity; natural monuments and natural landscapes with unique aspects; managed nature reserves and wildlife sanctuaries; protected landscapes (which may include cultural landscapes); and areas managed mainly for the sustainable use of natural systems to ensure long-term protection and maintenance of biological diversity.

A GIS analysis is used to calculate terrestrial and marine protection. For this a global protected area layer is created by combining the polygons and points recorded in the WDPA. Circular buffers are created around points based on the known extent of protected areas for which no polygon is available. Annual protected area layers are created by dissolving the global protected area layer by the known year of establishment of protected areas recorded in the WDPA. The annual protected area layers are overlaid with country/territory boundaries, coastlines and buffered coastlines (delineating the territorial waters) to obtain the absolute coverage (in square kilometers) of protected areas by country/territory per year from 1990 to present. The total area of a country's/territory's terrestrial protected areas and marine protected areas in territorial waters is divided by the total area of its land areas (including inland waters) and territorial waters to obtain the relative coverage (percentage) of protected areas.",Environment: Biodiversity & protected areas,Restricted use: Please contact the Protected Planet for third-party use of these data.,,Percentage,
40,EN.ATM.METH.EG.KT.CE,EN.ATM.METH.EG.KT.CE,Methane emissions in energy sector (thousand metric tons of CO2 equivalent),Methane emissions in energy sector,thousand metric tons of CO2 equivalent,EN.ATM.METH.EG.KT.CE,Sum,"The addition of man-made greenhouse gases to the Atmosphere disturbs the earth's radiative balance. This is leading to an increase in the earth's surface temperature and to related effects on climate, sea level rise and world agriculture. Emissions of CO2 are from burning oil, coal and gas for energy use, burning wood and waste materials, and from industrial processes such as cement production. Emission intensity is the average emission rate of a given pollutant from a given source relative to the intensity of a specific activity. Emission intensities are also used to compare the environmental impact of different fuels or activities. The related terms - emission factor and carbon intensity - are often used interchangeably.

The carbon dioxide emissions of a country are only an indicator of one greenhouse gas. For a more complete idea of how a country influences climate change, gases such as methane and nitrous oxide should be taken into account. This is particularly important in agricultural economies.

The environmental effects of carbon dioxide are of significant interest. Carbon dioxide (CO2) makes up the largest share of the greenhouse gases contributing to global warming and climate change. Converting all other greenhouse gases (methane (CH4), nitrous oxide (N2O), hydrofluorocarbons (HFCs), perfluorocarbons (PFCs), Sulphur hexafluoride (SF6)) to carbon dioxide (or CO2) equivalents makes it possible to compare them and to determine their individual and total contributions to global warming. The Kyoto Protocol, an environmental agreement adopted in 1997 by many of the parties to the United Nations Framework Convention on Climate Change (UNFCCC), is working towards curbing CO2 emissions globally.",Methane emissions in energy sector (thousand metric tons of CO2 equivalent),Attribution-NonCommercial 4.0 International (CC BY-NC 4.0),https://creativecommons.org/licenses/by-nc/4.0/,"This series excludes Land-use Change & Forestry (LUCF). 

The world data includes international bunker fuel-related emissions and emissions from territories not part of the United Nations Framework Convention on Climate Change (UNFCCC).","Methane emissions from energy processes are emissions from the production, handling, transmission, and combustion of fossil fuels and biofuels.",Annual,"Climate Watch Historical GHG Emissions (1990-2020). 2023. Washington, DC: World Resources Institute. Available online at: https://www.climatewatchdata.org/ghg-emissions","IPCC category 1 = Energy. Expressed in CO2 equivalent using the GWP100 metric of the Second Assessment Report of IPCC and include CH4 (GWP100=21). Methane emissions are those stemming from human activities such as agriculture and from industrial methane production. The emissions are usually expressed in carbon dioxide equivalents using the global warming potential, which allows the effective contributions of different gases to be compared. A kilogram of methane is 21 times as effective at trapping heat in the earth's atmosphere as a kilogram of carbon dioxide within 100 years. The unit of measurement is kt (kiloton) of carbon dioxide equivalent.",Environment: Emissions,,,,
41,SH.STA.WASH.P5,SH.STA.WASH.P5,"Mortality rate attributed to unsafe water, unsafe sanitation and lack of hygiene (per 100,000 population)","Mortality rate attributed to unsafe water, unsafe sanitation and lack of hygiene","per 100,000 population",SH.STA.WASH.P5,Weighted average,"Unsafe drinking water, unsafe sanitation and lack of hygiene are important causes of death.  Most diarrheal deaths in the world are caused by unsafe water, sanitation or hygiene.  According to the World Health Organization, in addition to diarrea, the following diseases could be prevented if adequate WASH services are provided: malnutrition, intestinal nematode infections, lymphatic filariasis, trachoma, schistosomiasis and malaria.","Mortality rate attributed to unsafe water, unsafe sanitation and lack of hygiene (per 100,000 population)",CC BY-4.0,https://datacatalog.worldbank.org/public-licenses#cc-by,Some countries do not have death registration data or sample registration systems.  The estimates on this indicator need to be completed with other type of information for these countries.,"Mortality rate attributed to unsafe water, unsafe sanitation and lack of hygiene is deaths attributable to unsafe water, sanitation and hygiene focusing on inadequate WASH services per 100,000 population. Death rates are calculated by dividing the number of deaths by the total population. In this estimate, only the impact of diarrhoeal diseases, intestinal nematode infections, and protein-energy malnutrition are taken into account.",Annual,"World Health Organization, Global Health Observatory Data Repository (http://apps.who.int/ghodata/).",,Health: Mortality,This is the Sustainable Development Goal indicator 3.9.2[https://unstats.un.org/sdgs/metadata/].,,,
