,id,id_x,value,title,unit,id_y,Aggregationmethod,Generalcomments,IndicatorName,License_Type,License_URL,Longdefinition,Periodicity,Source,Topic,Developmentrelevance,Limitationsandexceptions,Statisticalconceptandmethodology,Dataset,Shortdefinition
24,DT.NFL.IMFC.CD,DT.NFL.IMFC.CD,"Net financial flows, IMF concessional (NFL, current US$)","Net financial flows, IMF concessional","NFL, current US$",DT.NFL.IMFC.CD,Sum,,"Net financial flows, IMF concessional (NFL, current US$)",CC BY-4.0,https://datacatalog.worldbank.org/public-licenses#cc-by,"Net financial flows received by the borrower during the year are disbursements of loans and credits less repayments of principal. IMF is the International Monetary Fund, which provides concessional lending through the Poverty Reduction and Growth Facility and the IMF Trust Fund. Data are in current U.S. dollars.",Annual,"World Bank, International Debt Statistics.",Economic Policy & Debt: External debt: Net flows,,,"The International Monetary Fund (IMF) makes concessional funds available through its Extended Credit Facility (which replaced the Poverty Reduction and Growth Facility in 2010), the Standby Credit Facility, and the Rapid Credit Facility. Eligibility is based principally on a country's per capita income and eligibility under IDA.",International Debt Statistics,"Net financial flows received by the borrower during the year are disbursements of loans and credits less repayments of principal. IMF is the International Monetary Fund, which provides concessional lending through the Poverty Reduction and Growth Facility and the IMF Trust Fund. Data are in current U.S. dollars."
25,DT.NFL.IMFN.CD,DT.NFL.IMFN.CD,"Net financial flows, IMF nonconcessional (NFL, current US$)","Net financial flows, IMF nonconcessional","NFL, current US$",DT.NFL.IMFN.CD,Sum,,"Net financial flows, IMF nonconcessional (NFL, current US$)",CC BY-4.0,https://datacatalog.worldbank.org/public-licenses#cc-by,"Net financial flows received by the borrower during the year are disbursements of loans and credits less repayments of principal. IMF is the International Monetary Fund, which provides nonconcessional lending through the credit it provides to its members, mainly to meet balance of payments needs. Data are in current U.S. dollars.",Annual,"World Bank, International Debt Statistics.",Economic Policy & Debt: External debt: Net flows,,,"Nonconcessional lending from the IMF is provided mainly through Stand-by Arrangements, the Flexible Credit Line, and the Extended Fund Facility.",International Debt Statistics,"Net financial flows received by the borrower during the year are disbursements of loans and credits less repayments of principal. IMF is the International Monetary Fund, which provides nonconcessional lending through the credit it provides to its members, mainly to meet balance of payments needs. Data are in current U.S. dollars."
26,DT.NFL.MLAT.CD,DT.NFL.MLAT.CD,"Net financial flows, multilateral (NFL, current US$)","Net financial flows, multilateral","NFL, current US$",DT.NFL.MLAT.CD,Sum,,"Net financial flows, multilateral (NFL, current US$)",CC BY-4.0,https://datacatalog.worldbank.org/public-licenses#cc-by,"Public and publicly guaranteed multilateral loans include loans and credits from the World Bank, regional development banks, and other multilateral and intergovernmental agencies. Excluded are loans from funds administered by an international organization on behalf of a single donor government; these are classified as loans from governments. Net flows (or net lending or net disbursements) received by the borrower during the year are disbursements minus principal repayments. Data are in current U.S. dollars.",Annual,"World Bank, International Debt Statistics.",Economic Policy & Debt: External debt: Net flows,,,"Data show concessional and nonconcessional financial flows from international financial institutions. International financial institutions fund nonconcessional lending operations primarily by selling low-interest, highly rated bonds backed by prudent lending and financial policies and the strong financial support of their members. Funds are then on-lent to developing countries at slightly higher interest rates with 15- to 20-year maturities. Lending terms vary with market conditions and institutional policies. Concessional flows from international financial institutions are credits provided through concessional lending facilities. Subsidies from donors or other resources reduce the cost of these loans. Grants are not included in net flows.",International Debt Statistics,"Public and publicly guaranteed multilateral loans include loans and credits from the World Bank, regional development banks, and other multilateral and intergovernmental agencies. Excluded are loans from funds administered by an international organization on behalf of a single donor government; these are classified as loans from governments. Net flows (or net lending or net disbursements) received by the borrower during the year are disbursements minus principal repayments. Data are in current U.S. dollars."
27,DT.NFL.MOTH.CD,DT.NFL.MOTH.CD,"Net financial flows, others (NFL, current US$)","Net financial flows, others","NFL, current US$",DT.NFL.MOTH.CD,Sum,,"Net financial flows, others (NFL, current US$)",CC BY-4.0,https://datacatalog.worldbank.org/public-licenses#cc-by,"Net financial flows received by the borrower during the year are disbursements of loans and credits less repayments of principal. Others is a residual category in the World Bank's Debtor Reporting System. It includes such institutions as the Caribbean Development Fund, Council of Europe, European Development Fund, Islamic Development Bank, Nordic Development Fund, and the like. Data are in current U.S. dollars.",Annual,"World Bank, International Debt Statistics.",Economic Policy & Debt: External debt: Net flows,,,,International Debt Statistics,"Net financial flows received by the borrower during the year are disbursements of loans and credits less repayments of principal. Others is a residual category in the World Bank's Debtor Reporting System. It includes such institutions as the Caribbean Development Fund, Council of Europe, European Development Fund, Islamic Development Bank, Nordic Development Fund, and the like. Data are in current U.S. dollars."
28,DT.NFL.RDBC.CD,DT.NFL.RDBC.CD,"Net financial flows, RDB concessional (NFL, current US$)","Net financial flows, RDB concessional","NFL, current US$",DT.NFL.RDBC.CD,Sum,,"Net financial flows, RDB concessional (NFL, current US$)",CC BY-4.0,https://datacatalog.worldbank.org/public-licenses#cc-by,"Net financial flows received by the borrower during the year are disbursements of loans and credits less repayments of principal. Concessional financial flows cover disbursements made through concessional lending facilities. Regional development banks are the African Development Bank, in Tunis, Tunisia, which serves all of Africa, including North Africa; the Asian Development Bank, in Manila, Philippines, which serves South and Central Asia and East Asia and Pacific; the European Bank for Reconstruction and Development, in London, United Kingdom, which serves Europe and Central Asia; and the Inter-American Development Bank, in Washington, D.C., which serves the Americas. Aggregates include amounts for economies not specified elsewhere. Data are in current U.S. dollars.",Annual,"World Bank, International Debt Statistics.",Economic Policy & Debt: External debt: Net flows,,,Regional development banks also maintain concessional windows. Their loans are recorded according to each institution's classification and not according to the Organisation for Economic Co-operation and Development's (OECD) Development Assistance Committee (DAC) definition.,International Debt Statistics,"Net financial flows received by the borrower during the year are disbursements of loans and credits less repayments of principal. Concessional financial flows cover disbursements made through concessional lending facilities. Regional development banks are the African Development Bank, in Tunis, Tunisia, which serves all of Africa, including North Africa; the Asian Development Bank, in Manila, Philippines, which serves South and Central Asia and East Asia and Pacific; the European Bank for Reconstruction and Development, in London, United Kingdom, which serves Europe and Central Asia; and the Inter-American Development Bank, in Washington, D.C., which serves the Americas. Aggregates include amounts for economies not specified elsewhere. Data are in current U.S. dollars."
29,DT.NFL.RDBN.CD,DT.NFL.RDBN.CD,"Net financial flows, RDB nonconcessional (NFL, current US$)","Net financial flows, RDB nonconcessional","NFL, current US$",DT.NFL.RDBN.CD,Sum,,"Net financial flows, RDB nonconcessional (NFL, current US$)",CC BY-4.0,https://datacatalog.worldbank.org/public-licenses#cc-by,"Net financial flows received by the borrower during the year are disbursements of loans and credits less repayments of principal. Nonconcessional financial flows cover all disbursements except those made through concessional lending facilities. Regional development banks are the African Development Bank, in Tunis, Tunisia, which serves all of Africa, including North Africa; the Asian Development Bank, in Manila, Philippines, which serves South and Central Asia and East Asia and Pacific; the European Bank for Reconstruction and Development, in London, United Kingdom, which serves Europe and Central Asia; and the Inter-American Development Bank, in Washington, D.C., which serves the Americas. Aggregates include amounts for economies not specified elsewhere. Data are in current U.S. dollars.",Annual,"World Bank, International Debt Statistics.",Economic Policy & Debt: External debt: Net flows,,,,International Debt Statistics,"Net financial flows received by the borrower during the year are disbursements of loans and credits less repayments of principal. Nonconcessional financial flows cover all disbursements except those made through concessional lending facilities. Regional development banks are the African Development Bank, in Tunis, Tunisia, which serves all of Africa, including North Africa; the Asian Development Bank, in Manila, Philippines, which serves South and Central Asia and East Asia and Pacific; the European Bank for Reconstruction and Development, in London, United Kingdom, which serves Europe and Central Asia; and the Inter-American Development Bank, in Washington, D.C., which serves the Americas. Aggregates include amounts for economies not specified elsewhere. Data are in current U.S. dollars."
30,DT.NFL.DPNG.CD,DT.NFL.DPNG.CD,"Net flows on external debt, private nonguaranteed (PNG) (NFL, current US$)","Net flows on external debt, private nonguaranteed",PNG,DT.NFL.DPNG.CD,Sum,,"Net flows on external debt, private nonguaranteed (PNG) (NFL, current US$)",CC BY-4.0,https://datacatalog.worldbank.org/public-licenses#cc-by,"Private nonguaranteed external debt is an external obligation of a private debtor that is not guaranteed for repayment by a public entity. Net flows (or net lending or net disbursements) received by the borrower during the year are disbursements minus principal repayments. Long-term external debt is defined as debt that has an original or extended maturity of more than one year and that is owed to nonresidents by residents of an economy and repayable in currency, goods, or services. Data are in current U.S. dollars.",Annual,"World Bank, International Debt Statistics.",Economic Policy & Debt: External debt: Net flows,,,,International Debt Statistics,"Private nonguaranteed external debt is an external obligation of a private debtor that is not guaranteed for repayment by a public entity. Net flows (or net lending or net disbursements) received by the borrower during the year are disbursements minus principal repayments. Long-term external debt is defined as debt that has an original or extended maturity of more than one year and that is owed to nonresidents by residents of an economy and repayable in currency, goods, or services. Data are in current U.S. dollars."
31,DT.ODA.ODAT.GN.ZS,DT.ODA.ODAT.GN.ZS,Net ODA received (% of GNI),Net ODA received,% of GNI,DT.ODA.ODAT.GN.ZS,Weighted average,,Net ODA received (% of GNI),CC BY-4.0,https://datacatalog.worldbank.org/public-licenses#cc-by,"Net official development assistance (ODA) consists of disbursements of loans made on concessional terms (net of repayments of principal) and grants by official agencies of the members of the Development Assistance Committee (DAC), by multilateral institutions, and by non-DAC countries to promote economic development and welfare in countries and territories in the DAC list of ODA recipients. It includes loans with a grant element of at least 25 percent (calculated at a rate of discount of 10 percent).",Annual,"Development Assistance Committee of the Organisation for Economic Co-operation and Development, Geographical Distribution of Financial Flows to Developing Countries, Development Co-operation Report, and International Development Statistics database. Data are available online at: www.oecd.org/dac/stats/idsonline. World Bank GNI estimates are used for the denominator.",Economic Policy & Debt: Official development assistance,"The ratio of aid to GNI provides a measure of recipient country's dependency on aid. Ratios of aid are generally much higher in Sub-Saharan Africa than in other regions, and they increased in the 1980s. High ratios are due only in part to aid flows. Many African countries saw severe erosion in their terms of trade in the 1980s, along with weak policies, falling incomes, imports, and investment. Thus the increase in aid dependency ratios reflects events affecting both the numerator (aid) and the denominator (GNI).

DAC exists to help its members coordinate their development assistance and to encourage the expansion and improve the effectiveness of the aggregate resources flowing to recipient economies. In this capacity DAC monitors the flow of all financial resources, but its main concern is official development assistance (ODA). Grants or loans to countries and territories on the DAC list of aid recipients have to meet three criteria to be counted as ODA. They are provided by official agencies, including state and local governments, or by their executive agencies. They promote economic development and welfare as the main objective. And they are provided on concessional financial terms (loans must have a grant element of at least 25 percent, calculated at a discount rate of 10 percent). The DAC Statistical Reporting Directives provide the most detailed explanation of this definition and all ODA-related rules.

DAC statistics aim to meet the needs of policy makers in the field of development co-operation, and to provide a means of assessing the comparative performance of aid donors. DAC statistics are used extensively in the Peer Reviews conducted for each DAC member every four to five years, and have a wide range of other applications. They are used to measure donors' compliance with various international recommendations in the field of development co-operation (terms, volume), and are indispensable for analysis of virtually every aspect of development and development co-operation.

From 1960 to 1990, official development assistance (ODA) flows from DAC countries to developing countries rose steadily, but then fell sharply in the 1990s. Since then, a series of high-profile international conferences have boosted ODA flows. In the mid-2000s, ODA once again rose due to exceptional debt relief operations for Iraq and Nigeria. Despite the recent financial crisis, ODA flows have continued to rise and in the early 2010s reached their highest real level ever at about US $130 billion. This demonstrates effectiveness of aid pledges, especially when they are made on the basis of adequate resources and backed by strong political will.","Data on ODA is for aid-receiving countries. The data cover loans and grants from DAC member countries, multilateral organizations, and non-DAC donors. They do not reflect aid given by recipient countries to other developing countries. As a result, some countries that are net donors are shown as aid recipients. The indicator does not distinguish types of aid (program, project, or food aid; emergency assistance; or post-conflict peacekeeping assistance), which may have different effects on the economy.

Ratio of aid to gross national income (GNI) provides measures of recipient country's dependency on aid. But care must be taken in drawing policy conclusions. For foreign policy reasons some countries have traditionally received large amounts of aid. Thus aid dependency ratio may reveal as much about a donor's interests as about a recipient's needs. 

Because the indicator relies on information from donors, it is not necessarily consistent with information recorded by recipients in the balance of payments, which often excludes all or some technical assistance - particularly payments to expatriates made directly by the donor. Similarly, grant commodity aid may not always be recorded in trade data or in the balance of payments. Moreover, DAC statistics exclude aid for military and antiterrorism purposes.

The aggregates refer to World Bank classifications of economies and therefore may differ from those of the OECD.","The ODA excludes nonconcessional flows from official creditors, which are classified as ""other official flows,"" and aid for military and anti-terrorism purposes. Transfer payments to private individuals, such as pensions, reparations, and insurance payouts, are in general not counted. In addition to financial flows, ODA includes technical cooperation, most expenditures for peacekeeping under UN mandates and assistance to refugees, contributions to multilateral institutions such as the United Nations and its specialized agencies, and concessional funding to multilateral development banks.

The flows of official and private financial resources from the members of the Development Assistance Committee (DAC) of the Organisation for Economic Co-operation and Development (OECD) to developing economies are compiled by DAC, based principally on reporting by DAC members using standard questionnaires issued by the DAC Secretariat.

The ODA excludes nonconcessional flows from official creditors, which are classified as ""other official flows,"" and aid for military and anti-terrorism purposes. Transfer payments to private individuals, such as pensions, reparations, and insurance payouts, are in general not counted. In addition to financial flows, ODA includes technical cooperation, most expenditures for peacekeeping under UN mandates and assistance to refugees, contributions to multilateral institutions such as the United Nations and its specialized agencies, and concessional funding to multilateral development banks.

Flows are transfers of resources, either in cash or in the form of commodities or services measured on a cash basis. Short-term capital transactions (with one year or less maturity) are not counted. Repayments of the principal (but not interest) of ODA loans are recorded as negative flows. Proceeds from official equity investments in a developing country are reported as ODA, while proceeds from their later sale are recorded as negative flows.

The official development assistance estimates are published annually at the end of the calendar year in International Development Statistics (IDS) database. Net ODA received as a percent of GNI is calculated using values in U.S. dollars converted at official exchange rates.",,Net official development assistance is disbursement flows (net of repayment of principal) that meet the DAC definition of ODA and are made to countries and territories on the DAC list of aid recipients.
