,id,id_x,value,title,unit,id_y,Aggregationmethod,Generalcomments,IndicatorName,License_Type,License_URL,Longdefinition,Periodicity,Source,Topic,Developmentrelevance,Limitationsandexceptions,Statisticalconceptandmethodology,Dataset,Shortdefinition
37,BX.PEF.TOTL.CD.WD,BX.PEF.TOTL.CD.WD,"Portfolio equity, net inflows (BoP, current US$)","Portfolio equity, net inflows","BoP, current US$",BX.PEF.TOTL.CD.WD,Sum,Note: Data starting from 2005 are based on the sixth edition of the IMF's Balance of Payments Manual (BPM6).,"Portfolio equity, net inflows (BoP, current US$)",CC BY-4.0,https://datacatalog.worldbank.org/public-licenses#cc-by,"Portfolio equity includes net inflows from equity securities other than those recorded as direct investment and including shares, stocks, depository receipts (American or global), and direct purchases of shares in local stock markets by foreign investors. Data are in current U.S. dollars.",Annual,"International Monetary Fund, Balance of Payments database, and World Bank, International Debt Statistics.",Economic Policy & Debt: Balance of payments: Capital & financial account,"Private financial flows - equity and debt - account for the bulk of development finance. Equity flows comprise foreign direct investment (FDI) and portfolio equity. Debt flows are financing raised through bond issuance, bank lending, and supplier credits.","Portfolio investors typically have less of a role in the decision making of the enterprise with potentially important implications for future flows and for the volatility of the price and volume of positions. Portfolio investment differs from other investment in that it provides a direct way to access financial markets, and thus it can provide liquidity and flexibility. It is associated with financial markets and with their specialized service providers, such as exchanges, dealers, and regulators. The nature of financial derivatives as instruments through which risk is traded in its own right in financial markets sets them apart from other types of investment. Whereas other instruments may also have risk transfer elements, these other instruments also provide financial or other resources.

The volume of global private financial flows reported by the World Bank generally differs from that reported by other sources because of differences in sources, classification of economies, and method used to adjust and disaggregate reported information. In addition, particularly for debt financing, differences may also reflect how some installments of the transactions and certain offshore issuances are treated.

Data on equity flows are shown for all countries for which data are available.","Data on equity flows are based on balance of payments data reported by the International Monetary Fund (IMF).

Portfolio equity investment is defined as cross-border transactions and positions involving equity securities, other than those included in direct investment or reserve assets. Equity securities are equity instruments that are negotiable and designed to be traded, usually on organized exchanges or ""over the counter."" The negotiability of securities facilitates trading, allowing securities to be held by different parties during their lives. Negotiability allows investors to diversify their portfolios and to withdraw their investment readily. Included in portfolio investment are investment fund shares or units (that is, those issued by investment funds) that are evidenced by securities and that are not reserve assets or direct investment. Although they are negotiable instruments, exchange-traded financial derivatives are not included in portfolio investment because they are in their own category.",,
38,DT.NFL.BOND.CD,DT.NFL.BOND.CD,"Portfolio investment, bonds (PPG + PNG) (NFL, current US$)","Portfolio investment, bonds",PPG + PNG,DT.NFL.BOND.CD,Sum,,"Portfolio investment, bonds (PPG + PNG) (NFL, current US$)",CC BY-4.0,https://datacatalog.worldbank.org/public-licenses#cc-by,Bonds are securities issued with a fixed rate of interest for a period of more than one year. They include net flows through cross-border public and publicly guaranteed and private nonguaranteed bond issues. Data are in current U.S. dollars.,Annual,"World Bank, International Debt Statistics.",Economic Policy & Debt: External debt: Net flows,"External indebtedness affects a country's creditworthiness and investor perceptions. Nonreporting countries might have outstanding debt with the World Bank, other international financial institutions, or private creditors. Total debt service is contrasted with countries' ability to obtain foreign exchange through exports of goods, services, primary income, and workers' remittances.

Debt ratios are used to assess the sustainability of a country's debt service obligations, but no absolute rules determine what values are too high. Empirical analysis of developing countries' experience and debt service performance shows that debt service difficulties become increasingly likely when the present value of debt reaches 200 percent of exports. Still, what constitutes a sustainable debt burden varies by country. Countries with fast-growing economies and exports are likely to be able to sustain higher debt levels.","The DRS encourages debtor countries to voluntarily provide information on their short-term external obligations. By its nature, short-term external debt is difficult to monitor: loan-by-loan registration is normally impractical, and monitoring systems typically rely on information requested periodically by the central bank from the banking sector. The World Bank regards the debtor country as the authoritative source of information on its short-term debt. Where such information is not available from the debtor country, data are derived from BIS data on international bank lending based on time remaining to original maturity. The data are reported based on residual maturity, but an estimate of short-term external liabilities by original maturity can be derived by deducting from claims due in one year those that have a maturity of between one and two years. However, BIS data include liabilities reported only by banks within the BIS reporting area. The results should thus be interpreted with caution. Because short-term debt poses an immediate burden and is particularly important for monitoring vulnerability, it is compared with total debt and foreign exchange reserves, which are instrumental in providing coverage for such obligations.

A country's external debt burden, both debt outstanding and debt service, affects its creditworthiness and vulnerability. While data related to public and publicly guaranteed debt are reported to the DRS on a loan-by-loan basis, aggregate data on long-term private nonguaranteed debt are reported annually and are reported by the country or estimated by World Bank staff for countries where this type of external debt is known to be significant. Estimates are based on national data from the World Bank's Quarterly External Debt Statistics.","Bonds are debt instruments issued by public and publicly guaranteed or private debtors with durations of one year or longer. Bonds usually give the holder the unconditional right to fixed money income or contractually determined, variable money income.

Data on external debt are gathered through the World Bank's Debtor Reporting System (DRS). Long term debt data are compiled using the countries report on public and publicly guaranteed borrowing on a loan-by-loan basis and private non guaranteed borrowing on an aggregate basis. These data are supplemented by information from major multilateral banks and official lending agencies in major creditor countries. Short-term debt data are gathered from the Quarterly External Debt Statistics (QEDS) database, jointly developed by the World Bank and the IMF and from creditors through the reporting systems of the Bank for International Settlements. Debt data are reported in the currency of repayment and compiled and published in U.S. dollars. End-of-period exchange rates are used for the compilation of stock figures (amount of debt outstanding), and projected debt service and annual average exchange rates are used for the flows. Exchange rates are taken from the IMF's International Financial Statistics. Debt repayable in multiple currencies, goods, or services and debt with a provision for maintenance of the value of the currency of repayment are shown at book value.",,
39,DT.NFL.PBND.CD,DT.NFL.PBND.CD,"PPG, bonds (NFL, current US$)","PPG, bonds","NFL, current US$",DT.NFL.PBND.CD,Sum,,"PPG, bonds (NFL, current US$)",CC BY-4.0,https://datacatalog.worldbank.org/public-licenses#cc-by,Public and publicly guaranteed debt from bonds that are either publicly issued or privately placed. Net flows (or net lending or net disbursements) received by the borrower during the year are disbursements minus principal repayments. Data are in current U.S. dollars.,Annual,"World Bank, International Debt Statistics.",Economic Policy & Debt: External debt: Net flows,,,,International Debt Statistics,Public and publicly guaranteed debt from bonds that are either publicly issued or privately placed. Net flows (or net lending or net disbursements) received by the borrower during the year are disbursements minus principal repayments. Data are in current U.S. dollars.
40,DT.NFL.PCBK.CD,DT.NFL.PCBK.CD,"PPG, commercial banks (NFL, current US$)","PPG, commercial banks","NFL, current US$",DT.NFL.PCBK.CD,Sum,,"PPG, commercial banks (NFL, current US$)",CC BY-4.0,https://datacatalog.worldbank.org/public-licenses#cc-by,Public and publicly guaranteed commercial bank loans from private banks and other private financial institutions. Net flows (or net lending or net disbursements) received by the borrower during the year are disbursements minus principal repayments. Data are in current U.S. dollars.,Annual,"World Bank, International Debt Statistics.",Economic Policy & Debt: External debt: Net flows,,,,International Debt Statistics,Public and publicly guaranteed commercial bank loans from private banks and other private financial institutions. Net flows (or net lending or net disbursements) received by the borrower during the year are disbursements minus principal repayments. Data are in current U.S. dollars.
41,DT.DOD.MIBR.CD,DT.DOD.MIBR.CD,"PPG, IBRD (DOD, current US$)","PPG, IBRD","DOD, current US$",DT.DOD.MIBR.CD,Sum,,"PPG, IBRD (DOD, current US$)",CC BY-4.0,https://datacatalog.worldbank.org/public-licenses#cc-by,Public and publicly guaranteed debt outstanding from the International Bank for Reconstruction and Development (IBRD) is nonconcessional. Nonconcessional debt excludes loans with an original grant element of 35 percent or more. Data are in current U.S. dollars.,Annual,"World Bank, International Debt Statistics.",Economic Policy & Debt: External debt: Debt outstanding,,,,International Debt Statistics,Public and publicly guaranteed debt outstanding from the International Bank for Reconstruction and Development (IBRD) is nonconcessional. Nonconcessional debt excludes loans with an original grant element of 35 percent or more. Data are in current U.S. dollars.
42,DT.DOD.MIDA.CD,DT.DOD.MIDA.CD,"PPG, IDA (DOD, current US$)","PPG, IDA","DOD, current US$",DT.DOD.MIDA.CD,Sum,,"PPG, IDA (DOD, current US$)",CC BY-4.0,https://datacatalog.worldbank.org/public-licenses#cc-by,"Public and publicly guaranteed debt outstanding from the International Development Association (IDA) is concessional. Concessional debt is defined as loans with an original grant element of 35 percent or more. The grant element of a loan is the grant equivalent expressed as a percentage of the amount committed. It is used as a measure of the overall cost of borrowing. The grant equivalent of a loan is its commitment (present) value, less the discounted present value of its contractual debt service; conventionally, future service payments are discounted at 5 percent. Data are in current U.S. dollars.",Annual,"World Bank, International Debt Statistics.",Economic Policy & Debt: External debt: Debt outstanding,,,,International Debt Statistics,"Public and publicly guaranteed debt outstanding from the International Development Association (IDA) is concessional. Concessional debt is defined as loans with an original grant element of 35 percent or more. The grant element of a loan is the grant equivalent expressed as a percentage of the amount committed. It is used as a measure of the overall cost of borrowing. The grant equivalent of a loan is its commitment (present) value, less the discounted present value of its contractual debt service; conventionally, future service payments are discounted at 5 percent. Data are in current U.S. dollars."
43,DT.NFL.OFFT.CD,DT.NFL.OFFT.CD,"PPG, official creditors (NFL, current US$)","PPG, official creditors","NFL, current US$",DT.NFL.OFFT.CD,Sum,,"PPG, official creditors (NFL, current US$)",CC BY-4.0,https://datacatalog.worldbank.org/public-licenses#cc-by,"Public and publicly guaranteed debt from official creditors includes loans from international organizations (multilateral loans) and loans from governments (bilateral loans). Loans from international organization include loans and credits from the World Bank, regional development banks, and other multilateral and intergovernmental agencies. Excluded are loans from funds administered by an international organization on behalf of a single donor government; these are classified as loans from governments. Government loans include loans from governments and their agencies (including central banks), loans from autonomous bodies, and direct loans from official export credit agencies. Net flows (or net lending or net disbursements) received by the borrower during the year are disbursements minus principal repayments. Data are in current U.S. dollars.",Annual,"World Bank, International Debt Statistics.",Economic Policy & Debt: External debt: Net flows,,,,International Debt Statistics,"Public and publicly guaranteed debt from official creditors includes loans from international organizations (multilateral loans) and loans from governments (bilateral loans). Loans from international organization include loans and credits from the World Bank, regional development banks, and other multilateral and intergovernmental agencies. Excluded are loans from funds administered by an international organization on behalf of a single donor government; these are classified as loans from governments. Government loans include loans from governments and their agencies (including central banks), loans from autonomous bodies, and direct loans from official export credit agencies. Net flows (or net lending or net disbursements) received by the borrower during the year are disbursements minus principal repayments. Data are in current U.S. dollars."
44,DT.NFL.PROP.CD,DT.NFL.PROP.CD,"PPG, other private creditors (NFL, current US$)","PPG, other private creditors","NFL, current US$",DT.NFL.PROP.CD,Sum,,"PPG, other private creditors (NFL, current US$)",CC BY-4.0,https://datacatalog.worldbank.org/public-licenses#cc-by,"Public and publicly guaranteed other private credits from manufacturers, exporters, and other suppliers of goods, and bank credits covered by a guarantee of an export credit agency. Net flows (or net lending or net disbursements) received by the borrower during the year are disbursements minus principal repayments. Data are in current U.S. dollars.",Annual,"World Bank, International Debt Statistics.",Economic Policy & Debt: External debt: Net flows,,,,International Debt Statistics,"Public and publicly guaranteed other private credits from manufacturers, exporters, and other suppliers of goods, and bank credits covered by a guarantee of an export credit agency. Net flows (or net lending or net disbursements) received by the borrower during the year are disbursements minus principal repayments. Data are in current U.S. dollars."
45,DT.NFL.PRVT.CD,DT.NFL.PRVT.CD,"PPG, private creditors (NFL, current US$)","PPG, private creditors","NFL, current US$",DT.NFL.PRVT.CD,Sum,,"PPG, private creditors (NFL, current US$)",CC BY-4.0,https://datacatalog.worldbank.org/public-licenses#cc-by,"Public and publicly guaranteed debt from private creditors include bonds that are either publicly issued or privately placed; commercial bank loans from private banks and other private financial institutions; and other private credits from manufacturers, exporters, and other suppliers of goods, and bank credits covered by a guarantee of an export credit agency. Net flows (or net lending or net disbursements) received by the borrower during the year are disbursements minus principal repayments. Data are in current U.S. dollars.",Annual,"World Bank, International Debt Statistics.",Economic Policy & Debt: External debt: Net flows,,,,International Debt Statistics,"Public and publicly guaranteed debt from private creditors include bonds that are either publicly issued or privately placed; commercial bank loans from private banks and other private financial institutions; and other private credits from manufacturers, exporters, and other suppliers of goods, and bank credits covered by a guarantee of an export credit agency. Net flows (or net lending or net disbursements) received by the borrower during the year are disbursements minus principal repayments. Data are in current U.S. dollars."
46,DT.DOD.PVLX.EX.ZS,DT.DOD.PVLX.EX.ZS,"Present value of external debt (% of exports of goods, services and primary income)",Present value of external debt,"% of exports of goods, services and primary income",DT.DOD.PVLX.EX.ZS,,,"Present value of external debt (% of exports of goods, services and income)",CC BY-4.0,https://datacatalog.worldbank.org/public-licenses#cc-by,"Present value of debt is the sum of short-term external debt plus the discounted sum of total debt service payments due on public, publicly guaranteed, and private nonguaranteed long-term external debt over the life of existing loans. This calculation assumes that the PV of loans with a negative grant element is equal to the nominal value of the loan. The exports denominator is a three-year average.",Annual,"World Bank, International Debt Statistics.",Economic Policy & Debt: External debt: Debt ratios & other items,"External debt is that part of the total debt in a country that is owed to creditors outside the country. The debtors can be the government, corporations or private households. The debt includes money owed to private commercial banks, other governments, or international financial institutions.

External indebtedness affects a country's creditworthiness and investor perceptions. Nonreporting countries might have outstanding debt with the World Bank, other international financial institutions, or private creditors. Total debt service is contrasted with countries' ability to obtain foreign exchange through exports of goods, services, primary income, and workers' remittances.

Debt ratios are used to assess the sustainability of a country's debt service obligations, but no absolute rules determine what values are too high. Empirical analysis of developing countries' experience and debt service performance shows that debt service difficulties become increasingly likely when the present value of debt reaches 200 percent of exports. Still, what constitutes a sustainable debt burden varies by country. Countries with fast-growing economies and exports are likely to be able to sustain higher debt levels. Various indicators determine a sustainable level of external debt, including:

a) debt to GDP ratio
b) foreign debt to exports ratio
c) government debt to current fiscal revenue ratio 
d) share of foreign debt
e) short-term debt
f) concessional debt in the total debt stock",,"Data on external debt are gathered through the World Bank's Debtor Reporting System (DRS). Long term debt data are compiled using the countries report on public and publicly guaranteed borrowing on a loan-by-loan basis and private non guaranteed borrowing on an aggregate basis. These data are supplemented by information from major multilateral banks and official lending agencies in major creditor countries. Short-term debt data are gathered from the Quarterly External Debt Statistics (QEDS) database, jointly developed by the World Bank and the IMF and from creditors through the reporting systems of the Bank for International Settlements. Debt data are reported in the currency of repayment and compiled and published in U.S. dollars. End-of-period exchange rates are used for the compilation of stock figures (amount of debt outstanding), and projected debt service and annual average exchange rates are used for the flows. Exchange rates are taken from the IMF's International Financial Statistics. Debt repayable in multiple currencies, goods, or services and debt with a provision for maintenance of the value of the currency of repayment are shown at book value.",,"Present value of debt is the sum of short-term external debt plus the discounted sum of total debt service payments due on public, publicly guaranteed, and private nonguaranteed long-term external debt over the life of existing loans. The exports denominator is a three-year average."
47,DT.DOD.PVLX.GN.ZS,DT.DOD.PVLX.GN.ZS,Present value of external debt (% of GNI),Present value of external debt,% of GNI,DT.DOD.PVLX.GN.ZS,,,Present value of external debt (% of GNI),CC BY-4.0,https://datacatalog.worldbank.org/public-licenses#cc-by,"Present value of debt is the sum of short-term external debt plus the discounted sum of total debt service payments due on public, publicly guaranteed, and private nonguaranteed long-term external debt over the life of existing loans. This calculation assumes that the PV of loans with a negative grant element is equal to the nominal value of the loan. The GNI denominator is a three-year average.",Annual,"World Bank, International Debt Statistics.",Economic Policy & Debt: External debt: Debt ratios & other items,"External debt is that part of the total debt in a country that is owed to creditors outside the country. The debtors can be the government, corporations or private households. The debt includes money owed to private commercial banks, other governments, or international financial institutions.

External indebtedness affects a country's creditworthiness and investor perceptions. Nonreporting countries might have outstanding debt with the World Bank, other international financial institutions, or private creditors. Total debt service is contrasted with countries' ability to obtain foreign exchange through exports of goods, services, primary income, and workers' remittances.

Debt ratios are used to assess the sustainability of a country's debt service obligations, but no absolute rules determine what values are too high. Empirical analysis of developing countries' experience and debt service performance shows that debt service difficulties become increasingly likely when the present value of debt reaches 200 percent of exports. Still, what constitutes a sustainable debt burden varies by country. Countries with fast-growing economies and exports are likely to be able to sustain higher debt levels. Various indicators determine a sustainable level of external debt, including:

a) debt to GDP ratio
b) foreign debt to exports ratio
c) government debt to current fiscal revenue ratio 
d) share of foreign debt
e) short-term debt
f) concessional debt in the total debt stock",,"Data on external debt are gathered through the World Bank's Debtor Reporting System (DRS). Long term debt data are compiled using the countries report on public and publicly guaranteed borrowing on a loan-by-loan basis and private non guaranteed borrowing on an aggregate basis. These data are supplemented by information from major multilateral banks and official lending agencies in major creditor countries. Short-term debt data are gathered from the Quarterly External Debt Statistics (QEDS) database, jointly developed by the World Bank and the IMF and from creditors through the reporting systems of the Bank for International Settlements. Debt data are reported in the currency of repayment and compiled and published in U.S. dollars. End-of-period exchange rates are used for the compilation of stock figures (amount of debt outstanding), and projected debt service and annual average exchange rates are used for the flows. Exchange rates are taken from the IMF's International Financial Statistics. Debt repayable in multiple currencies, goods, or services and debt with a provision for maintenance of the value of the currency of repayment are shown at book value.",,"Present value of debt is the sum of short-term external debt plus the discounted sum of total debt service payments due on public, publicly guaranteed, and private nonguaranteed long-term external debt over the life of existing loans. The GNI denominator is a three-year average."
