,id,id_x,value,title,unit,id_y,Aggregationmethod,Developmentrelevance,IndicatorName,License_Type,License_URL,Longdefinition,Periodicity,Source,Statisticalconceptandmethodology,Topic,Limitationsandexceptions,Generalcomments
0,EG.ELC.ACCS.UR.ZS,EG.ELC.ACCS.UR.ZS,"Access to electricity, urban (% of urban population)","Access to electricity, urban",% of urban population,EG.ELC.ACCS.UR.ZS,Weighted average,,"Access to electricity, urban (% of urban population)",CC BY-4.0,https://datacatalog.worldbank.org/public-licenses#cc-by,"Access to electricity, urban is the percentage of urban population with access to electricity.",Annual,"IEA, IRENA, UNSD, World Bank, WHO. 2023. Tracking SDG 7: The Energy Progress Report. World Bank, Washington DC. © World Bank. License: Creative Commons Attribution—NonCommercial 3.0 IGO (CC BY-NC 3.0 IGO).","The World Bank’s Global Electrification Database (GED) compiles nationally representative household survey data, and occasionally census data, from sources going back as far as 1990. The database also incorporates data from the Socio-Economic Database for Latin America and the Caribbean (SEDLAC), Middle East and North Africa Poverty Database (MNAPOV) and the Europe and Central Asia Poverty Database (ECAPOV), which are based on similar surveys. At the time of this analysis, the GED contained 1,375 surveys for 149 countries in 1990-2021.",Environment: Energy production & use,,
1,SH.STA.TRAF.P5,SH.STA.TRAF.P5,"Mortality caused by road traffic injury (per 100,000 population)",Mortality caused by road traffic injury,"per 100,000 population",SH.STA.TRAF.P5,Weighted average,Road traffic injuries and deaths is a major global public health problem. Road traffic crashes are currently the leading cause of death for children and young adults in the world.  There is a strong association between the risk of road traffic death and the income level of countries.  The burden of road traffic deaths is disproportionately high among low- and middle-income countries.,"Mortality caused by road traffic injury (per 100,000 population)",CC BY-4.0,https://datacatalog.worldbank.org/public-licenses#cc-by,"Mortality caused by road traffic injury is estimated road traffic fatal injury deaths per 100,000 population.",Annual,"World Health Organization, Global Health Observatory Data Repository (http://apps.who.int/ghodata/).",,Health: Mortality,,This is the Sustainable Development Goal indicator 3.6.1 [https://unstats.un.org/sdgs/metadata/].
2,EN.ATM.PM25.MC.M3,EN.ATM.PM25.MC.M3,"PM2.5 air pollution, mean annual exposure (micrograms per cubic meter)","PM2.5 air pollution, mean annual exposure",micrograms per cubic meter,EN.ATM.PM25.MC.M3,Weighted average,"Air pollution places a major burden on world health. In many places, including cities but also in rural areas, exposure to air pollution is the main environmental threat to health, responsible for 6.5 million deaths per year, about one every 5 seconds. Around 40 percent of the world’s people rely on household burning of wood, charcoal, dung, crop waste, or coal to meet basic energy needs. Cooking and heating with solid fuels create harmful smoke and particles that fill homes and the surrounding environment. Household air pollution from cooking and heating with solid fuels is responsible for 2.9 million deaths a year. Long-term exposure to high levels of fine particles in the air contributes to a range of health effects, including respiratory diseases, lung cancer, and heart disease, resulting in 4.2 million deaths annually. Not only does exposure to air pollution affect the health of the world’s people, it also carries huge economic costs and represents a drag on development, particularly for low and middle income countries and vulnerable segments of the population such as children and the elderly.","PM2.5 air pollution, mean annual exposure (micrograms per cubic meter)",CC BY-4.0,https://datacatalog.worldbank.org/public-licenses#cc-by,"Population-weighted exposure to ambient PM2.5 pollution is defined as the average level of exposure of a nation's population to concentrations of suspended particles measuring less than 2.5 microns in aerodynamic diameter, which are capable of penetrating deep into the respiratory tract and causing severe health damage. Exposure is calculated by weighting mean annual concentrations of PM2.5 by population in both urban and rural areas.",Annual,"Global Burden of Disease Collaborative Network. 2021. Global Burden of Disease Study 2019 (GBD 2019) Air Pollution Exposure Estimates 1990-2019. Seattle, United States of America: Institute for Health Metrics and Evaluation (IHME). https://doi.org/10.6069/70JS-NC54","A. van Donkelaar, R.V. Martin, M. Brauer, N.C. Hsu, R.A. Kahn, R.C. Levy, A. Lyapustin, A.M. Sayer, D.M. Winker, ""Global Estimates of Fine Particulate Matter using a Combined Geophysical-Statistical Method with Information from Satellites, Models, and Monitors,"" Environ. Sci. Technol 50, no. 7 (2016): 3762–3772; GBD 2017 Risk Factors Collaborators, ""Global, regional, and national comparative risk assessment of 84 behavioural, environmental and occupational, and metabolic risks or clusters of risks for 194 countries and territories, 1990–2017: a systematic analysis for the Global Burden of Disease Study 2017,"" Lancet 392 (2018): 1923-1994; Shaddick G, Thomas M, Amini H, Broday DM, Cohen A, Frostad J, Green A, Gumy S, Liu Y, Martin RV, Prüss-Üstün A, Simpson D, van Donkelaar A, Brauer M. Data integration for the assessment of population exposure to ambient air pollution for global burden of disease assessment. Environ Sci Technol. 2018 Jun 29. Data provided by Institute for Health Metrics and Evaluation, University of Washington, Seattle. Data on exposure to ambient air pollution are derived from estimates of annual concentrations of very fine particulates produced by the Global Burden of Disease study, an international scientific effort led by the Institute for Health Metrics and Evaluation at the University of Washington. Estimates of annual concentrations are generated by combining data from atmospheric chemistry transport models, satellite observations of aerosols in the atmosphere, and ground-level monitoring of particulates. Exposure to concentrations of PM2.5 in both urban and rural areas is weighted by population and is aggregated at the national level.",Environment: Emissions,"Pollutant concentrations are sensitive to local conditions, and even monitoring sites in the same city may register different levels. Direct monitoring of PM2.5 is still rare in most parts of the world, and measurement protocols and standards are not the same for all countries. These data should be considered only a general indication of air quality, intended to inform cross-country comparisons of the health risks due to particulate matter pollution. The guideline set by the World Health Organization (WHO) for PM2.5 is that annual mean concentrations should not exceed 10 micrograms per cubic meter, representing the lower range over which adverse health effects have been observed. The WHO has also recommended guideline values for emissions of PM2.5 from burning fuels in households.",
3,EN.ATM.PM25.MC.ZS,EN.ATM.PM25.MC.ZS,"PM2.5 air pollution, population exposed to levels exceeding WHO guideline value (% of total)","PM2.5 air pollution, population exposed to levels exceeding WHO guideline value",% of total,EN.ATM.PM25.MC.ZS,Weighted average,"Air pollution places a major burden on world health. In many places, including cities but also in rural areas, exposure to air pollution is the main environmental threat to health, responsible for 6.5 million deaths per year, about one every 5 seconds. Around 40 percent of the world’s people rely on household burning of wood, charcoal, dung, crop waste, or coal to meet basic energy needs. Cooking and heating with solid fuels create harmful smoke and particles that fill homes and the surrounding environment. Household air pollution from cooking and heating with solid fuels is responsible for 2.9 million deaths a year. Long-term exposure to high levels of fine particles in the air contributes to a range of health effects, including respiratory diseases, lung cancer, and heart disease, resulting in 4.2 million deaths annually. Not only does exposure to air pollution affect the health of the world’s people, it also carries huge economic costs and represents a drag on development, particularly for low and middle income countries and vulnerable segments of the population such as children and the elderly.","PM2.5 air pollution, population exposed to levels exceeding WHO guideline value (% of total)",CC BY-4.0,https://datacatalog.worldbank.org/public-licenses#cc-by,"Percent of population exposed to ambient concentrations of PM2.5 that exceed the WHO guideline value is defined as the portion of a country’s population living in places where mean annual concentrations of PM2.5 are greater than 10 micrograms per cubic meter, the guideline value recommended by the World Health Organization as the lower end of the range of concentrations over which adverse health effects due to PM2.5 exposure have been observed.",Annual,"Brauer, M. et al. 2017, for the Global Burden of Disease Study 2017.","A. van Donkelaar, R.V. Martin, M. Brauer, N.C. Hsu, R.A. Kahn, R.C. Levy, A. Lyapustin, A.M. Sayer, D.M. Winker, ""Global Estimates of Fine Particulate Matter using a Combined Geophysical-Statistical Method with Information from Satellites, Models, and Monitors,"" Environ. Sci. Technol 50, no. 7 (2016): 3762–3772; GBD 2017 Risk Factors Collaborators, ""Global, regional, and national comparative risk assessment of 84 behavioural, environmental and occupational, and metabolic risks or clusters of risks for 194 countries and territories, 1990–2017: a systematic analysis for the Global Burden of Disease Study 2017,"" Lancet 392 (2018): 1923-1994; Shaddick G, Thomas M, Amini H, Broday DM, Cohen A, Frostad J, Green A, Gumy S, Liu Y, Martin RV, Prüss-Üstün A, Simpson D, van Donkelaar A, Brauer M. Data integration for the assessment of population exposure to ambient air pollution for global burden of disease assessment. Environ Sci Technol. 2018 Jun 29. Data provided by Institute for Health Metrics and Evaluation, University of Washington, Seattle. Data on exposure to ambient air pollution are derived from estimates of annual concentrations of very fine particulates produced by the Global Burden of Disease study, an international scientific effort led by the Institute for Health Metrics and Evaluation at the University of Washington. Estimates of annual concentrations are generated by combining data from atmospheric chemistry transport models, satellite observations of aerosols in the atmosphere, and ground-level monitoring of particulates. Overlaying PM2.5 estimates with gridded population data, the percent of a nation's people that lives in areas where PM2.5 concentrations exceed recommended levels is calculated by summing the population for grid cells where PM2.5 concentrations are beyond a threshold value, in this case 10 micrograms per cubic meter, and then dividing by total population.",Environment: Emissions,"Pollutant concentrations are sensitive to local conditions, and even monitoring sites in the same city may register different levels. Direct monitoring of PM2.5 is still rare in most parts of the world, and measurement protocols and standards are not the same for all countries. These data should be considered only a general indication of air quality, intended to inform cross-country comparisons of the health risks due to particulate matter pollution. The guideline set by the World Health Organization (WHO) for PM2.5 is that annual mean concentrations should not exceed 10 micrograms per cubic meter, representing the lower range over which adverse health effects have been observed. The WHO has also recommended guideline values for emissions of PM2.5 from burning fuels in households.",
4,EN.POP.DNST,EN.POP.DNST,Population density (people per sq. km of land area),Population density,people per sq. km of land area,EN.POP.DNST,Weighted average,"Population estimates are usually based on national population censuses. Estimates for the years before and after the census are interpolations or extrapolations based on demographic models. Errors and undercounting occur even in high-income countries; in developing countries errors may be substantial because of limits in the transport, communications, and other resources required conducting and analyzing a full census.

Population density is a measure of the intensity of land-use, and can be calculated for a block, city, county, state, country, continent or the entire world. Considering that over half of the Earth's land mass consists of areas inhospitable to human inhabitation, such as deserts and high mountains, and that population tends to cluster around seaports and fresh water sources, a simple number of population density by itself does not give any meaningful measurement of human population density.

Several of the most densely populated territories in the world are city-states, microstates, or dependencies.[6][7] These territories share a relatively small area and a high urbanization level, with an economically specialized city population drawing also on rural resources outside the area, illustrating the difference between high population density and overpopulation.",Population density (people per sq. km of land area),CC BY-4.0,https://datacatalog.worldbank.org/public-licenses#cc-by,"Population density is midyear population divided by land area in square kilometers. Population is based on the de facto definition of population, which counts all residents regardless of legal status or citizenship--except for refugees not permanently settled in the country of asylum, who are generally considered part of the population of their country of origin. Land area is a country's total area, excluding area under inland water bodies, national claims to continental shelf, and exclusive economic zones. In most cases the definition of inland water bodies includes major rivers and lakes.",Annual,Food and Agriculture Organization and World Bank population estimates.,"Population density is midyear population divided by land area in square kilometers. This ratio can be calculated for any territorial unit for any point in time, depending on the source of the population data. Populationestimates are prepared by World Bank staff from variety of sources. They are based on the de facto definition of population and include all residents regardless of legal status or citizenship, within the physical boundaries of a country and under the jurisdiction of that country's political control. Refugees not permanently settled in the country of asylum are considered part of the population of their country of origin. Population numbers are either current census data or historical census data extrapolated through demographic methods. The count also excludes visitors from overseas.

Population density is calculated by dividing midyear population by land area in a country. Population is based on the de facto definition of population, which counts all residents regardless of legal status or citizenship - except for refugees not permanently settled in the country of asylum, who are generally considered part of the population of their country of origin. Land area is a country's total area, excluding area under inland water bodies, national claims to continental shelf, and exclusive economic zones. In most cases the definition of inland water bodies includes major rivers and lakes.",Environment: Density & urbanization,"Current population estimates for developing countries that lack recent census data and pre- and post-census estimates for countries with census data are provided by the United Nations Population Division and other agencies. The cohort component method - a standard method for estimating and projecting population - requires fertility, mortality, and net migration data, often collected from sample surveys, which can be small or limited in coverage. Population estimates are from demographic modeling and so are susceptible to biases and errors from shortcomings in the model and in the data. Because the five-year age group is the cohort unit and five-year period data are used, interpolations to obtain annual data or single age structure may not reflect actual events or age composition.

The quality and reliability of official demographic data are also affected by public trust in the government, government commitment to full and accurate enumeration, confidentiality and protection against misuse of census data, and census agencies' independence from political influence. Moreover, comparability of population indicators is limited by differences in the concepts, definitions, collection procedures, and estimation methods used by national statistical agencies and other organizations that collect the data.",
5,EN.URB.LCTY,EN.URB.LCTY,Population in largest city,Population in largest city,,EN.URB.LCTY,,"A metropolitan area includes the urban area, and its satellite cities plus intervening rural land that is socio-economically connected to the urban core city, typically by employment ties through commuting, with the urban core city being the primary labor market. According to the United Nations' definition, a metropolitan area includes both the contiguous territory inhabited at urban levels of residential density and additional surrounding areas of lower settlement density that are also under the direct influence of the city (e.g., through frequent transport, road linkages, commuting facilities etc.).

Explosive growth of cities globally signifies the demographic transition from rural to urban, and is associated with shifts from an agriculture-based economy to mass industry, technology, and service. For the first time ever, the majority of the world's population lives in a city, and this proportion continues to grow. One hundred years ago, 2 out of every 10 people lived in an urban area. By 1990, less than 40 percent of the global population lived in a city, but as of early 2010s, more than half of all people live in an urban area. By 2030, 6 out of every 10 people will live in a city, and by 2050, this proportion will increase to 7 out of 10 people. About half of all urban dwellers live in cities with between 100,000-500,000 people, and fewer than 10% of urban dwellers live in megacities (a city with a population of more than 10 million, as defined by UN HABITAT). Currently, the number of urban residents is growing by nearly 60 million every year.

By the middle of the 21st century, the urban population will almost double, reaching 6.4 billion in 2050. Almost all urban population growth in the next 30 years will occur in cities of developing countries. By the middle of the 21st century, it is estimated that the urban population of developing counties will more than double, reaching almost 5.2 billion in 2050. In high-income countries, the urban population is expected to remain largely unchanged over the next two decades, reaching to just over 1 billion by 2025. In these countries, immigration (legal and illegal) will account for more than two-thirds of urban growth. Without immigration, the urban population in these countries would most likely decline or remain static.

In principle, cities offer a more favorable setting for the resolution of social and environmental problems than rural areas. Cities generate jobs and income, and deliver education, health care and other services. Cities also present opportunities for social mobilization and women's empowerment. Poverty is growing faster in urban than in rural areas. According to UN one billion people live in urban slums, which are typically overcrowded, polluted and dangerous, and lack basic services such as clean water and sanitation.",Population in largest city,CC BY-4.0,https://datacatalog.worldbank.org/public-licenses#cc-by,Population in largest city is the urban population living in the country's largest metropolitan area.,Annual,"United Nations, World Urbanization Prospects.","Urban population refers to people living in urban areas as defined by national statistical offices. The indicator is calculated using World Bank population estimates and urban ratios from the United Nations World Urbanization Prospects. The United Nations Population Division and other agencies provide current population estimates for developing countries that lack recent census data and pre- and post-census estimates for countries with census data. The cohort component method - a standard method for estimating and projecting population - requires fertility, mortality, and net migration data, often collected from sample surveys, which can be small or limited in coverage. Population estimates are from demographic modeling and so are susceptible to biases and errors from shortcomings in the model and in the data. Because the five-year age group is the cohort unit and five-year period data are used, interpolations to obtain annual data or single age structure may not reflect actual events or age composition.

Countries differ in the way they classify population as ""urban"" or ""rural."" Typically, a community or settlement with a population of 2,000 or more is considered urban, but national definitions are most commonly based on size of locality. Eurostat defines urban areas as clusters of contiguous grid cells of 1 km2 with a density of at least 300 inhabitants per km2 and a minimum population of 5,000. Further it defines high-density cluster as contiguous grid cells of 1 km2 with a density of at least 1,500 inhabitants per km2 and a minimum population of 50,000.

The population of a city or metropolitan area depends on the boundaries chosen. For example, in 1990 Beijing, China, contained 2.3 million people in 87 square kilometers of ""inner city"" and 5.4 million in 158 square kilometers of ""core city."" The population of ""inner city and inner suburban districts"" was 6.3 million and that of ""inner city, inner and outer suburban districts, and inner and outer counties"" was 10.8 million. (Most countries use the last definition.)",Environment: Density & urbanization,"Aggregation of urban and rural population may not add up to total population because of different country coverage. There is no consistent and universally accepted standard for distinguishing urban from rural areas, in part because of the wide variety of situations across countries.

 Most countries use an urban classification related to the size or characteristics of settlements. Some define urban areas based on the presence of certain infrastructure and services. And other countries designate urban areas based on administrative arrangements. Because of national differences in the characteristics that distinguish urban from rural areas, the distinction between urban and rural population is not amenable to a single definition that would be applicable to all countries. For example, in Botswana, agglomeration of 5,000 or more inhabitants where 75 per cent of the economic activity is non-agricultural is considered ""urban"" while in Iceland localities of 200 or more inhabitants, and in Peru population centers with 100 or more dwellings, are considered ""urban."" In the United States places of 2,500 or more inhabitants, generally having population densities of 1,000 persons per square mile or more are considered ""urban"".

Estimates of the world's urban population would change significantly if China, India, and a few other populous nations were to change their definition of urban centers. According to China's State Statistical Bureau, by the end of 1996 urban residents accounted for about 43 percent of China's population, more than double the 20 percent considered urban in 1994. In addition to the continuous migration of people from rural to urban areas, one of the main reasons for this shift was the rapid growth in the hundreds of towns reclassified as cities in recent years.

Because the estimates of city and metropolitan area are based on national definitions of what constitutes a city or metropolitan area, cross-country comparisons should be made with caution. To estimate urban populations, UN ratios of urban to total population were applied to the World Bank's estimates of total population.",
